Quest Venture Partners,https://www.crunchbase.com/organization/quest-venture-partners,"Micro VC, Venture Capital",107,22,"Palo Alto, California, United States","Early Stage Venture, Late Stage Venture, Seed, Venture",Early stage venture capital firm based in Palo Alto California,"San Francisco Bay Area, Silicon Valley, West Coast",2008-01-01,year,http://www.questvp.com,https://www.linkedin.com/company/quest-venture-partners/,67,15,1
Steamboat Ventures,https://www.crunchbase.com/organization/steamboat-ventures,Corporate Venture Capital,107,30,"Glendale, California, United States",,Named after the Mickey Mouse cartoon Steamboat Willie -- a great innovation at the time -- we help young companies become market leaders.,"Greater Los Angeles Area, West Coast, Western US",2000-09-15,day,http://steamboatvc.com,https://www.linkedin.com/company/steamboat-ventures,55,24,7
Rothenberg Ventures,https://www.crunchbase.com/organization/rothenberg-ventures,"Accelerator, Micro VC, Venture Capital",107,36,"San Francisco, California, United States","Early Stage Venture, Seed",Rothenberg Ventures invests in early-stage frontier technology startups.,"San Francisco Bay Area, West Coast, Western US",2012-09-01,month,http://www.rothenbergventures.com,http://www.linkedin.com/company/rothenberg-ventures,89,5,5
Stanford University,https://www.crunchbase.com/organization/stanford-university,University Program,106,42,"Stanford, California, United States",,"Stanford University is a teaching and research university that focuses on graduate programs in law, medicine, education, and business.","San Francisco Bay Area, West Coast, Western US",1885-11-11,day,http://www.stanford.edu,https://www.linkedin.com/school/stanford-university,92,1,7
Bezos Expeditions,https://www.crunchbase.com/organization/bezos-expeditions,"Family Investment Office, Venture Capital",106,25,"Washington, District of Columbia, United States","Early Stage Venture, Late Stage Venture, Seed",Bezos Expeditions manages Jeff Bezos' personal venture capital investments.,"Washington DC Metro Area, Southern US",2005-01-01,year,https://www.bezosexpeditions.com/index.html,,67,19,11
Slack Fund,https://www.crunchbase.com/organization/slack-fund,Corporate Venture Capital,106,14,"Daly City, California, United States","Early Stage Venture, Seed",The Slack Fund is an investment fund company to create the fund for support team building products on top of slack.,"San Francisco Bay Area, West Coast, Western US",2013-01-01,year,https://slack.com/developers/fund,,77,18,
Tim Draper,https://www.crunchbase.com/person/timothy-draper,"Individual/Angel, Investment Partner",105,25,"San Francisco, California, United States",Seed,Tim Draper is the Founding Partner of Draper Associates. He attended Harvard Business School.,"San Francisco Bay Area, West Coast, Western US",,,,https://www.linkedin.com/in/timothydraper,94,23,3
Ronald Conway,https://www.crunchbase.com/person/ron-conway,"Individual/Angel, Investment Partner",105,60,"San Francisco, California, United States",Seed,Ronald Conway has been an active angel investor for over 15 years. He was the Founder and Managing Partner of the Angel Investors LP funds (...,"San Francisco Bay Area, West Coast, Western US",,,,https://www.linkedin.com/in/ron-conway-17692953/,96,2,7
Puget Sound Venture Club,https://www.crunchbase.com/organization/puget-sound-venture-club,Angel Group,105,15,"Bellevue, Washington, United States","Convertible Note, Early Stage Venture, Late Stage Venture, Post-Ipo, Seed, Venture",Puget Sound Venture club is to provide a forum to review venture opportunities.,"Greater Seattle Area, West Coast, Western US",1985-01-01,year,http://www.pugetsoundvc.com,https://www.linkedin.com/company/puget-sound-investment-group,102,2,4
Agility Capital,https://www.crunchbase.com/organization/agility-capital,Venture Debt,105,42,"Santa Barbara, California, United States","Debt, Non Equity Assistance, Post-Ipo","Agility Capital, a venture debt fund, offers senior debt solutions to venture capital-backed private companies in the Western United States.","West Coast, Western US",2000-06-09,day,http://www.agilitycap.com,http://www.linkedin.com/company/3059038,103,,9
Cyan Banister,https://www.crunchbase.com/person/cyan-banister,"Individual/Angel, Investment Partner",105,27,"San Francisco, California, United States",Seed,"Cyan Banister is a partner at Founders Fund, where she invests across sectors and stages with a particular interest in augmented reality, fe...","San Francisco Bay Area, West Coast, Western US",,,https://www.longjourney.vc/,http://www.linkedin.com/in/cyanb,93,4,4
Blu Venture Investors,https://www.crunchbase.com/organization/blu-venture-investors,"Angel Group, Micro VC, Venture Capital",104,10,"Vienna, Virginia, United States","Debt, Early Stage Venture, Seed, Venture","Blu Venture Investors is a venture capital firm that supports early stage companies, primarily focused on cybersecurity.","Washington DC Metro Area, East Coast, Southern US",2010-01-01,year,https://www.bluventureinvestors.com,https://www.linkedin.com/company/bluventures,70,28,1
Moderne Ventures,https://www.crunchbase.com/organization/moderne-ventures,"Accelerator, Private Equity Firm, Venture Capital",104,24,"Chicago, Illinois, United States","Early Stage Venture, Late Stage Venture, Private Equity",Moderne Ventures is a strategic venture capital and growth equity firm.,"Greater Chicago Area, Great Lakes, Midwestern US",2015-07-01,day,http://www.moderneventures.com,https://www.linkedin.com/company/6628465,85,13,3
Tech Wildcatters,https://www.crunchbase.com/organization/tech-wildcatters,"Accelerator, Venture Capital",104,13,"Dallas, Texas, United States","Early Stage Venture, Late Stage Venture, Seed, Venture",A mentorship-driven VC fund and startup accelerator.,"Dallas/Fort Worth Metroplex, Southern US",2009-07-01,day,http://techwildcatters.com,http://www.linkedin.com/company/tech-wildcatters,98,66,
Detroit Venture Partners,https://www.crunchbase.com/organization/detroit-venture-partners,Micro VC,104,12,"Detroit, Michigan, United States","Early Stage Venture, Late Stage Venture, Seed, Venture",Detroit Venture Partners is an American venture capital firm that funds seed- and early-stage technology companies.,"Greater Detroit Area, Great Lakes, Midwestern US",2010-11-01,day,http://Detroit.vc,https://www.linkedin.com/company/detroit-venture-partners,64,42,
Max Levchin,https://www.crunchbase.com/person/max-levchin,"Individual/Angel, Investment Partner",104,34,"San Francisco, California, United States",Seed,Max Levchin is the Founder and CEO of Affirm. He previously worked at the Consumer Financial Protection Bureau as an Advisory Board Member. ...,"San Francisco Bay Area, West Coast, Western US",,,,https://www.linkedin.com/in/maxlevchin,84,4,6
XG Ventures,https://www.crunchbase.com/organization/xg-ventures,Micro VC,103,30,"Menlo Park, California, United States","Early Stage Venture, Seed","XG Ventures focuses on the consumer internet, including the mobile, video, gaming, social media, and online media sectors.","San Francisco Bay Area, Silicon Valley, West Coast",2008-03-01,day,http://www.xg-ventures.com,https://www.linkedin.com/company/2835770,79,,1
Kevin Hartz,https://www.crunchbase.com/person/kevin-hartz,"Individual/Angel, Investment Partner",102,21,"San Francisco, California, United States",Seed,"Kevin is the Co-Founder and GP of A* Capital & The Co-Founder & Chairman of Eventbrite (NYSE: EB) Prior A* Capital, Kevin was at Founders F...","San Francisco Bay Area, West Coast, Western US",,,http://www.a-star.co,http://www.linkedin.com/in/hartz,91,1,8
Idealab,https://www.crunchbase.com/organization/idealab,Incubator,102,37,"Pasadena, California, United States","Early Stage Venture, Late Stage Venture, Seed, Venture",Idealab is a technology incubator that provides resources to allow start-ups to rapidly introduce innovative products and services.,"Greater Los Angeles Area, West Coast, Western US",1996-03-14,day,http://www.idealab.com,https://www.linkedin.com/company/idealab,82,14,5
Desafia,https://www.crunchbase.com/organization/spain-tech-center,"Accelerator, Venture Capital",102,9,"San Francisco, California, United States","Early Stage Venture, Non Equity Assistance, Seed",Spain Tech Center is now Desafia,"San Francisco Bay Area, West Coast, Western US",2011-01-01,year,https://www.sanfrancisco.desafia.gob.es/,https://www.linkedin.com/company/desafia,101,95,1
Johnson & Johnson Innovation – JJDC,https://www.crunchbase.com/organization/johnson-johnson-innovation-jjdc,Corporate Venture Capital,101,19,"Cambridge, Massachusetts, United States","Early Stage Venture, Late Stage Venture, Post-Ipo, Seed",JJDC finds transformative ideas and helps them mature into real solutions for today’s patients. ,"Greater Boston Area, East Coast, New England",1973-01-01,year,https://www.jnjinnovation.com/jjdc,https://www.linkedin.com/company/prominex-inc,74,31,10
Pipeline Angels,https://www.crunchbase.com/organization/pipeline-fund,"Angel Group, Venture Capital",101,6,"Houston, Texas, United States","Early Stage Venture, Seed",Pipeline Angels is changing the face of angel investing and creating capital for women and non-binary femme social entrepreneurs. ,"Greater Houston Area, Southern US",2011-01-01,year,http://pipelineangels.com/,http://www.linkedin.com/company/pipeline-angels,93,22,
Ann Arbor SPARK,https://www.crunchbase.com/organization/ann-arbor-spark,Accelerator,100,17,"Ann Arbor, Michigan, United States","Debt, Early Stage Venture, Grant, Seed",Ann Arbor SPARK is Ann Arbor’s engine for economic development.,"Great Lakes, Midwestern US",2005-05-01,day,http://www.annarborusa.org/,http://www.linkedin.com/company/816516,89,10,4
General Motors Ventures,https://www.crunchbase.com/organization/general-motors-ventures,"Corporate Venture Capital, Venture Capital",100,16,"Warren, Michigan, United States","Early Stage Venture, Late Stage Venture, Post-Ipo, Venture",General Motors Ventures is a Michigan-based company financing growth-stage tech companies since 2010.,"Greater Detroit Area, Great Lakes, Midwestern US",2010-06-01,day,http://www.gmventures.com,https://www.linkedin.com/company/gmventures,51,27,3
Human Ventures,https://www.crunchbase.com/organization/human-ventures-capital,"Angel Group, Venture Capital",99,8,"New York, New York, United States","Early Stage Venture, Seed",Human Ventures is an investment fund based in New York that provides support to founders in the early stages of their businesses.,"Greater New York Area, East Coast, Northeastern US",2015-01-01,year,http://human.vc,https://www.linkedin.com/company/human-ventures-capital,66,6,
BoomStartup,https://www.crunchbase.com/organization/boomstartup,Accelerator,99,12,"Salt Lake City, Utah, United States",Seed,BoomStartup is a Utah-based accelerator that provides seed funding and mentorship to tech entrepreneurs.,Western US,2010-02-01,day,http://boomstartup.com,http://www.linkedin.com/company/boomstartup,97,,
Plug and Play Insurtech,https://www.crunchbase.com/organization/plug-and-play-insurance-accelerator,Accelerator,99,22,"Sunnyvale, California, United States","Early Stage Venture, Seed","Deal flow sessions, themed workshops, and face-to-face interaction drive engagement between financial powerhouses and young upstarts. ","San Francisco Bay Area, Silicon Valley, West Coast",2013-01-01,year,http://plugandplaytechcenter.com/insurance/,https://www.linkedin.com/company/plug-and-play-tech-center/,98,50,
Brainchild Holdings,https://www.crunchbase.com/organization/trisiras-group,"Micro VC, Venture Capital",98,44,"Newtown, Pennsylvania, United States","Early Stage Venture, Seed",Kal Vepuri's personal investment vehicle.,"Greater Philadelphia Area, Great Lakes, Northeastern US",2010-01-01,day,https://brainchild.co/,https://www.linkedin.com/company-beta/5352605/,89,1,4
Merck Global Health Innovation Fund,https://www.crunchbase.com/organization/merck-global-health-innovation-fund,Corporate Venture Capital,98,26,"Whitehouse Station, New Jersey, United States","Early Stage Venture, Private Equity",Merck Global Health Innovation Fund (Merck GHI) is evolving corporate healthcare venture capital globally by utilizing their healthcare,"Greater New York Area, East Coast, Northeastern US",2010-01-01,year,http://www.merck.com/ghi,https://www.linkedin.com/company/merck,63,47,6
Horizon Technology Finance,https://www.crunchbase.com/organization/horizon-technology-finance,Venture Debt,97,44,"Farmington, Connecticut, United States","Debt, Post-Ipo, Venture",Horizon Technology Finance is a specialty finance company offering secured loans to venture-backed companies.,"East Coast, New England, Northeastern US",2003-01-01,year,https://horizontechfinance.com,https://www.linkedin.com/company/horizon-technology-finance-corporation,93,67,19
Bradley Horowitz,https://www.crunchbase.com/person/bradley-horowitz,"Individual/Angel, Investment Partner",97,15,"Palo Alto, California, United States",Seed,"Bradley Horowitz is an Advisor and Vice President of Product Management at Google. Most recently he helped create Area 120, Google's incubat...","San Francisco Bay Area, Silicon Valley, West Coast",,,http://www.google.com,http://www.linkedin.com/in/bradleyhorowitz,92,1,5
Ruttenberg Gordon Investments,https://www.crunchbase.com/organization/ruttenberg-gordon-investments,"Family Investment Office, Private Equity Firm, Venture Capital",97,15,"New York, New York, United States","Convertible Note, Early Stage Venture, Late Stage Venture, Private Equity, Seed, Venture","Ruttenberg Gordon Investments specializes in equity and debt investments in real estate, private equity, growth equity.","Greater New York Area, East Coast, Northeastern US",2013-01-01,year,https://www.ruttenberggordon.com/,https://www.linkedin.com/company/ruttenberg-gordon-investments/about/,96,2,2
AccelFoods,https://www.crunchbase.com/organization/accelfoods,Accelerator,97,10,"New York, New York, United States","Convertible Note, Early Stage Venture, Seed","AccelFoods invests in disruptive food and beverage companies and provides them with industry access, expertise, and infrastructure.","Greater New York Area, East Coast, Northeastern US",2014-01-01,year,http://accelfoods.com,https://www.linkedin.com/company/afventures/,42,26,
Ascension Ventures,https://www.crunchbase.com/organization/ascension-ventures,"Corporate Venture Capital, Venture Capital",97,31,"Clarkton, Missouri, United States","Early Stage Venture, Late Stage Venture, Seed, Venture",Ascension Ventures is a strategic healthcare venture fund and early-stage venture capital firm.,Midwestern US,2001-01-01,year,http://ascensionventures.org/,http://www.linkedin.com/company/ascension-media-group,69,28,5
Healthbox,https://www.crunchbase.com/organization/healthbox,Accelerator,97,16,"Chicago, Illinois, United States","Early Stage Venture, Late Stage Venture, Seed",Healthbox is a healthcare advisory firm that helps an organization develop their strategies and programs.,"Greater Chicago Area, Great Lakes, Midwestern US",2010-01-01,year,http://www.healthbox.com,https://www.linkedin.com/company/healthbox,88,4,
Cantos,https://www.crunchbase.com/organization/cantos-ventures,Micro VC,95,8,"San Francisco, California, United States",Seed,"A pre-seed firm obsessively pursuing the near frontier – where software, hardware, & wetware intersect.","San Francisco Bay Area, West Coast, Western US",2016-03-01,month,http://cantos.vc/,https://www.linkedin.com/company/cantos-ventures,67,11,
BP Ventures,https://www.crunchbase.com/organization/bp-ventures,Corporate Venture Capital,95,13,"Palo Alto, California, United States","Early Stage Venture, Late Stage Venture, Seed, Venture",BP Ventures is a venture capital firm that identifies and invests in private and high-growth technology companies.,"San Francisco Bay Area, Silicon Valley, West Coast",2012-01-01,year,https://www.bp.com/en/global/ventures.html,https://www.linkedin.com/company/bp/,69,47,1
Takeda Ventures,https://www.crunchbase.com/organization/takeda-ventures,Corporate Venture Capital,95,28,"San Diego, California, United States","Early Stage Venture, Late Stage Venture",Takeda Ventures focuses on high-caliber therapeutic and platform based opportunities around the world.,"Greater San Diego Area, West Coast, Western US",2001-01-01,year,https://www.takeda.com/what-we-do/research-and-development/takeda-ventures,https://www.linkedin.com/company/takeda-ventures-inc.,67,18,11
Cedars-Sinai Accelerator,https://www.crunchbase.com/organization/the-cedars-sinai-accelerator,Accelerator,95,8,"Los Angeles, California, United States","Convertible Note, Early Stage Venture, Seed, Venture",Cedars-Sinai Accelerator is a collaboration to help today’s technology innovators turn their ideas into breakthroughs.,"Greater Los Angeles Area, West Coast, Western US",2015-12-01,month,http://www.csaccelerator.com,https://www.linkedin.com/company/csaccelerator/,87,39,
Sanderling Ventures,https://www.crunchbase.com/organization/sanderling-ventures,Micro VC,95,19,"San Mateo, California, United States","Debt, Early Stage Venture, Late Stage Venture, Post-Ipo, Venture",Sanderling Ventures is an investment firm that works on building and funding new biomedical companies.,"San Francisco Bay Area, Silicon Valley, West Coast",1979-01-01,year,http://www.sanderling.com,https://www.linkedin.com/company/sanderling-ventures/,42,23,7
Tao Capital Partners,https://www.crunchbase.com/organization/tao-capital-partners,Family Investment Office,94,18,"San Francisco, California, United States","Early Stage Venture, Late Stage Venture, Seed, Venture","Tao Capital Partners invests in technology, transportation, healthcare, education, and food businesses.","San Francisco Bay Area, West Coast, Western US",2002-11-07,day,http://www.taocap.com,https://www.linkedin.com/company/tao-capital-partners,57,14,9
Nat Friedman,https://www.crunchbase.com/person/nat-friedman,"Individual/Angel, Investment Partner",94,6,"San Francisco, California, United States",,Nat Friedman is an entrepreneur and developer. He attended the Massachusetts Institute of Technology. Nat Friedman has two degrees from MIT ...,"San Francisco Bay Area, West Coast, Western US",,,https://nat.org,https://www.linkedin.com/in/natfriedman,71,18,
Keyhorse Capital (KSTC),https://www.crunchbase.com/organization/keyhorse,"Fund Of Funds, Micro VC, Syndicate, Venture Capital",94,20,"Louisville, Kentucky, United States","Convertible Note, Early Stage Venture, Seed, Venture",Early stage venture capital supporting Kentucky-based entrepreneurs willing to go the distance. (Investment arm of KSTC),Southern US,2001-01-01,year,https://www.keyhorse.vc,https://www.linkedin.com/company/keyhorse,79,5,4
Warner Media,https://www.crunchbase.com/organization/time-warner-investments,"Corporate Venture Capital, Venture Capital",94,40,"New York, New York, United States","Early Stage Venture, Late Stage Venture",Warner Media is an investor of an early to midstage companies that can generate strategic value for the Time Warner's businesses.,"Greater New York Area, East Coast, Northeastern US",1998-01-01,year,http://www.timewarner.com/our-company/tw-investments,https://www.linkedin.com/company/warnermediagroup/,62,22,3
Reid Hoffman,https://www.crunchbase.com/person/reid-hoffman,"Individual/Angel, Investment Partner",93,37,"San Francisco, California, United States",Seed,Reid Hoffman is the Partner of Greylock. He previously worked at Convoy Inc as a Board Member. Reid Hoffman attended the University of Perug...,"San Francisco Bay Area, West Coast, Western US",,,http://reidhoffman.org,http://www.linkedin.com/in/reidhoffman,81,7,4
Propel(X),https://www.crunchbase.com/organization/propelx,"Angel Group, Hedge Fund, Venture Capital",92,7,"San Francisco, California, United States","Early Stage Venture, Late Stage Venture, Seed",Propel(x) is an angel investing platform focused on funding early-stage companies that are built around scientific discovery.,"San Francisco Bay Area, West Coast, Western US",2014-08-01,day,https://www.propelx.com/,https://www.linkedin.com/company/propel-x-/,84,2,
Applied Ventures,https://www.crunchbase.com/organization/applied-ventures,Corporate Venture Capital,92,19,"Santa Clara, California, United States","Early Stage Venture, Late Stage Venture, Seed, Venture","Applied Ventures is the venture capital fund of Applied Materials, the global leader in nanomanufacturing technology.","San Francisco Bay Area, Silicon Valley, West Coast",2006-01-01,year,http://appliedventures.com/,https://www.linkedin.com/company/applied-ventures-llc/,60,21,5
The House Fund,https://www.crunchbase.com/organization/the-house-fund,"Accelerator, Micro VC, Venture Capital",92,14,"Berkeley, California, United States","Early Stage Venture, Seed, Venture",The House Fund is a pre-seed and early stage venture capital fund focused on the boldest Berkeley startups.,"San Francisco Bay Area, West Coast, Western US",2015-01-01,year,http://thehouse.fund,https://www.linkedin.com/company/the-house-fund,76,7,
Circle Ventures,https://www.crunchbase.com/organization/circle-ventures-5201,Corporate Venture Capital,92,5,"East Boston, Massachusetts, United States","Early Stage Venture, Initial Coin Offering, Seed, Venture",Circle Ventures invests in projects that accelerate global crypto innovation and adoption in service.,"Greater Boston Area, East Coast, New England",2013-01-01,year,https://www.circle.com/en/circle-ventures,https://www.linkedin.com/company/circle-internet-financial,91,2,
Wayne Chang,https://www.crunchbase.com/person/wayne-chang,"Individual/Angel, Investment Partner",92,30,"Manhattan, New York, United States",Seed,Wayne Chang is the Founder and CEO of Reasoner. He previously worked at Crashlytics as a Co-Founder and Chairman. Wayne Chang attended the U...,"Greater New York Area, East Coast, Northeastern US",,,https://chang.com,http://www.linkedin.com/in/waynechang,83,4,4
Foothill Ventures,https://www.crunchbase.com/organization/tsingyuan-ventures,Micro VC,91,6,"Los Altos, California, United States","Early Stage Venture, Late Stage Venture, Private Equity, Seed, Venture",Foothill Ventures is a technology-focused venture fund that invests in seed to A-round startups in the United States.,"San Francisco Bay Area, Silicon Valley, West Coast",2017-01-01,day,https://www.foothill.ventures/,https://www.linkedin.com/company/foothillventures/,75,18,
Nitesh Banta,https://www.crunchbase.com/person/nitesh-banta,"Individual/Angel, Investment Partner",91,11,"New York, New York, United States",Seed,Nitesh Banta is the Co-Founder & CEO at B12.,"Greater New York Area, East Coast, Northeastern US",,,https://www.nbanta.com,http://www.linkedin.com/in/nbanta,84,,1
HealthTech Capital,https://www.crunchbase.com/organization/healthtech-capital,Angel Group,91,10,"Los Altos Hills, California, United States","Convertible Note, Early Stage Venture, Seed",HealthTech Capital is a group of private investors dedicated to funding and mentoring new HealthTech start ups,"San Francisco Bay Area, Silicon Valley, West Coast",2010-01-01,year,http://www.healthtechcapital.com,https://www.linkedin.com/company/healthtech-capital/,59,10,1
Grand Central Tech,https://www.crunchbase.com/organization/grand-central-tech,Accelerator,91,20,"New York, New York, United States","Early Stage Venture, Non Equity Assistance, Seed",Grand Central Tech is a New York-based startup-in-residence program that offers 1 year of free rent without an equity commitment.,"Greater New York Area, East Coast, Northeastern US",2014-03-01,day,http://www.grandcentraltech.com/,https://www.linkedin.com/company/grand-central-tech/,91,35,
Heavybit,https://www.crunchbase.com/organization/heavybit-industries,"Accelerator, Venture Capital",91,21,"San Francisco, California, United States","Early Stage Venture, Late Stage Venture, Seed, Venture",Heavybit is the leading investor in dev-first companies with an unrivaled track record helping technical founders achieve breakout success.,"San Francisco Bay Area, West Coast, Western US",2013-01-01,year,https://www.heavybit.com,http://www.linkedin.com/company/heavybit,63,13,1
Mango Capital,https://www.crunchbase.com/organization/mango-capital,"Micro VC, Venture Capital",90,9,"San Francisco, California, United States","Early Stage Venture, Seed",Mango Capital is an enterprise focused seed & early stage venture capital investment firm.,"San Francisco Bay Area, West Coast, Western US",2018-01-01,year,https://www.mangocap.com,https://www.linkedin.com/company/mangocapital/,71,3,1
Refactor,https://www.crunchbase.com/organization/refactor-capital,"Micro VC, Venture Capital",90,10,"Burlingame, California, United States","Early Stage Venture, Seed","Refactor Capital is a seed stage VC firm investing $1-2M into hard tech startups from its 4th fund, $50M in size.","San Francisco Bay Area, West Coast, Western US",2016-01-01,year,http://www.refactor.com,https://www.linkedin.com/company/refactor-capital/,62,15,1
IDEA Fund Partners,https://www.crunchbase.com/organization/idea-fund-partners,"Micro VC, Venture Capital",90,14,"Chapel Hill, North Carolina, United States","Early Stage Venture, Late Stage Venture, Seed, Venture",IDEA Fund Partners is a venture capital firm focusing on technology and business model innovations.,"Research Triangle, East Coast, Southern US",2006-01-01,day,http://www.ideafundpartners.com,http://www.linkedin.com/company/idea-fund-partners,56,24,
LearnLaunch Fund + Accelerator,https://www.crunchbase.com/organization/learnlaunchfund,"Accelerator, Venture Capital",90,11,"Boston, Massachusetts, United States","Early Stage Venture, Seed, Venture",LearnLaunch Fund + Accelerator invests in and supports entrepreneurs on the mission to positively transform education.,"Greater Boston Area, East Coast, New England",2013-01-01,day,https://learnlaunch.com/accelerator/,http://www.linkedin.com/company/learnlaunchx,81,12,
