Ryan Hood,https://www.crunchbase.com/person/ryan-hood,Individual/Angel,4,,"Cologne, Nordrhein-Westfalen, Germany",Seed,Ryan Hood - CEO @ hood.de,"European Union (EU), Europe, Middle East, and Africa (EMEA)",,,,https://www.linkedin.com/in/ryan-hood-a8507822,3,,
Christian Dereser,https://www.crunchbase.com/person/christian-dereser,"Individual/Angel, Investment Partner",4,1,"Nuremberg, Bayern, Germany",,Christian Dereser,"European Union (EU), Europe, Middle East, and Africa (EMEA)",,,,,4,,
Wilfried Gillrath,https://www.crunchbase.com/person/wilfried-gillrath,Individual/Angel,4,,"Hamburg, Hamburg, Germany",,Wilfried Gillrath served as CEO of the LichtBlick Group.,"European Union (EU), Europe, Middle East, and Africa (EMEA)",,,,https://www.linkedin.com/in/wilfried-gillrath-8b7705208,4,1,
Clemens Kaiser,https://www.crunchbase.com/person/clemens-kaiser,Individual/Angel,4,,"München, Bayern, Germany",Seed,Clemens Kaiser is the Managing Director & CTO at KLEO Connect. Clemens Kaiser attended Technical University of Munich.,"European Union (EU), Europe, Middle East, and Africa (EMEA)",,,https://www.esa.int/esatv/Videos/2015/11/Sentinel-3_Technology_and_heritage/Soundbites_-_Kaiser_Clemens_Director_of_development_EUMETSAT_-_English_and_German,https://www.linkedin.com/in/clemens-kaiser-92010ba8/,1,,
Matthias Spiess,https://www.crunchbase.com/person/matthias-spiess,Individual/Angel,4,1,"Berlin, Berlin, Germany",Seed,Matthias Spiess is the Co-Founder and CTO of Spreadshirt. He previously worked at Spread Group as a CTO. Matthias Spiess attended Technical ...,"European Union (EU), Europe, Middle East, and Africa (EMEA)",,,,https://www.linkedin.com/in/spiess,3,,
Christian Weiss,https://www.crunchbase.com/person/christian-weiss,Individual/Angel,4,,"Berlin, Berlin, Germany",Seed,Christian Weiss is the Founding Partner & Managing director of Data4Life. He previously worked at Project A Ventures as a Founding Partner.C...,"European Union (EU), Europe, Middle East, and Africa (EMEA)",,,,https://www.linkedin.com/in/chweiss,4,,
Cornelia Hoppe,https://www.crunchbase.com/person/cornelia-hoppe,Individual/Angel,4,,"Berlin, Berlin, Germany",,Cornelia Hoppe,"European Union (EU), Europe, Middle East, and Africa (EMEA)",,,https://www.linkedin.com/in/thecornelia/,,3,,
Glenn Elliott,https://www.crunchbase.com/person/glenn-elliott,Individual/Angel,4,,"Berlin, Berlin, Germany",Private Equity,Chair at MPLC,"European Union (EU), Europe, Middle East, and Africa (EMEA)",,,,,4,,
Sascha Kuehn,https://www.crunchbase.com/person/sascha-kuehn,Individual/Angel,4,1,"Dresden, Sachsen, Germany",Seed,Sascha Kuehn is the Co-Founder and Chairman of the Board of Kraftwerk Inc.,"European Union (EU), Europe, Middle East, and Africa (EMEA)",,,,https://www.linkedin.com/in/drkuehn,2,2,
Just Beyer,https://www.crunchbase.com/person/just-beyer,"Individual/Angel, Investment Partner",4,,"Berlin, Berlin, Germany",,Just Beyer,"European Union (EU), Europe, Middle East, and Africa (EMEA)",,,,https://www.linkedin.com/in/justwbeyer/,4,,
Heinz-Werner Nienstedt,https://www.crunchbase.com/person/heinz-werner-nienstedt,Individual/Angel,4,2,"Düsseldorf, Nordrhein-Westfalen, Germany",Seed,Heinz-Werner Nienstedt - Chairman @ Nienstedt,"European Union (EU), Europe, Middle East, and Africa (EMEA)",,,,https://de.linkedin.com/in/heinz-werner-nienstedt-780276,3,,
Ann-Kristin Achleitner,https://www.crunchbase.com/person/ann-kristin-achleitner,Individual/Angel,4,,"München, Bayern, Germany",,Ann-Kristin Achleitner is a professor at the Technical University of Munich.,"European Union (EU), Europe, Middle East, and Africa (EMEA)",,,,https://www.linkedin.com/in/ann-kristin-achleitner-720189198/,4,,
Jan Kaniess,https://www.crunchbase.com/person/jan-kaniess,Individual/Angel,4,,"Berlin, Berlin, Germany",,Jan Kaniess currently works as the Co-Founder and Managing Director for SixVenture GmbH. He Previously worked at Ingenico PAYONE Holding Gmb...,"European Union (EU), Europe, Middle East, and Africa (EMEA)",,,,https://www.linkedin.com/in/jan0kaniess,3,,
Helmut Nanz,https://www.crunchbase.com/person/helmut-nanz,Individual/Angel,4,,"Stuttgart, Baden-Wurttemberg, Germany",,Helmut Nanz,"European Union (EU), Europe, Middle East, and Africa (EMEA)",,,,https://www.linkedin.com/in/helmut-c-nanz-66b9213b/,2,,
Tobias Wittich,https://www.crunchbase.com/person/tobias-wittich,Individual/Angel,4,,"Berlin, Berlin, Germany",,"Founded The Place Berlin, great ecosystem and hottest co-working space for startups in Berlin. Before worked at PWC in Zurich. Leverages exp...","European Union (EU), Europe, Middle East, and Africa (EMEA)",,,http://theplaceberlin.com/,https://www.linkedin.com/in/tobias-wittich-329179/,4,,
Stefan H. Lauer,https://www.crunchbase.com/person/stefan-h-lauer,Individual/Angel,4,,"Frankfurt, Hessen, Germany",,Stefan H. Lauer,"European Union (EU), Europe, Middle East, and Africa (EMEA)",,,,https://www.linkedin.com/in/stefan-h-lauer-b46b2568/,2,,
Oliver Hehl,https://www.crunchbase.com/person/oliver-hehl,Individual/Angel,4,1,"Walldorf, Baden-Wurttemberg, Germany","Early Stage Venture, Seed","Oliver Hehl is the Investor and Advisory Board Member of Jobful. He was a Founder, Head of Business Development SMB DACH, Executive Board Me...","European Union (EU), Europe, Middle East, and Africa (EMEA)",,,https://ahanya.vc,https://www.linkedin.com/in/oliver-hehl,3,1,
Rodrigo Martinez,https://www.crunchbase.com/person/rodrigo-martinez-2,"Individual/Angel, Investment Partner",3,,"Berlin, Berlin, Germany",,"Rodrigo joined Point Nine Cap after finishing his MBA at London Business School in 2013. Before that, he was a Summer Associate at Index Ven...","European Union (EU), Europe, Middle East, and Africa (EMEA)",,,,https://www.linkedin.com/in/rodrigomrz,3,,
Naren Shaam,https://www.crunchbase.com/person/naren-shaam,Individual/Angel,3,,"Berlin, Berlin, Germany",,"Naren Shaam, born in India and educated in the US, worked as a Global Product Manager managing multi-miliion $ in business in auto industry ...","European Union (EU), Europe, Middle East, and Africa (EMEA)",,,,https://www.linkedin.com/in/narenshaam,3,,
Tarek Muller,https://www.crunchbase.com/person/tarek-müller,Individual/Angel,3,,"Hamburg, Hamburg, Germany",,"Tarek Müller (29) is one of the co-founders and managing directors of ABOUT YOU,which is among the fastest-expanding e-commerce start-ups in...","European Union (EU), Europe, Middle East, and Africa (EMEA)",,,,https://www.linkedin.com/in/tarek-m%C3%BCller-19898845/,3,,
Berthold von Freyberg,https://www.crunchbase.com/person/berthold-von-freyberg,"Individual/Angel, Investment Partner",3,,"Munich, Bayern, Germany",,"Berthold von Freyberg, Partner, brings 21 years of venture capital and technology experience in Germany and the USA to the partnership. H...","European Union (EU), Europe, Middle East, and Africa (EMEA)",,,,https://www.linkedin.com/in/bertholdvonfreyberg,3,1,
Simon Willnauer,https://www.crunchbase.com/person/simon-willnauer,Individual/Angel,3,,"Berlin, Berlin, Germany",,Simon Willnauer is the Founder and Tech lead Elasticsearch of Elastic. He previously worked at Simon Willnauer as a Freelancer. Simon Willna...,"European Union (EU), Europe, Middle East, and Africa (EMEA)",,,,https://www.linkedin.com/in/simonwillnauer,3,,
Julian Weselek,https://www.crunchbase.com/person/julian-weselek,Individual/Angel,3,,"Berlin, Berlin, Germany",,Julian is the co-founder & CEO of Tourlane. Julian graduated as best in class from the London School of Economics before joining company bui...,"European Union (EU), Europe, Middle East, and Africa (EMEA)",,,https://www.tourlane.com/,https://www.linkedin.com/in/julianweselek/,3,,
Tobias Balling,https://www.crunchbase.com/person/tobias-balling,Individual/Angel,3,,"Berlin, Berlin, Germany",,Tobias Balling is the CTO & Founder at Blinkist.,"European Union (EU), Europe, Middle East, and Africa (EMEA)",,,,https://www.linkedin.com/in/tobias-balling-38195063/,2,,
Elmar Broscheit,https://www.crunchbase.com/person/elmar-broscheit,"Individual/Angel, Investment Partner",3,,"Berlin, Berlin, Germany",,Elmar Broscheit is the CFO and Co-Founder at Gorillas.,"European Union (EU), Europe, Middle East, and Africa (EMEA)",,,,https://www.linkedin.com/in/elmar-broscheit,3,,
Ramin Niroumand,https://www.crunchbase.com/person/ramin-niroumand,"Individual/Angel, Investment Partner",3,,"Berlin, Berlin, Germany",Early Stage Venture,"Ramin Niroumand, Partner of Motive Partners and Head of Motive Ventures, is known as the Fintech-Pioneer in Germany. Before Motive Partners,...","European Union (EU), Europe, Middle East, and Africa (EMEA)",,,,https://www.linkedin.com/in/rniroumand/,3,,
Jascha Samadi,https://www.crunchbase.com/person/jascha-samadi,"Individual/Angel, Investment Partner",3,1,"Berlin, Berlin, Germany","Early Stage Venture, Seed, Venture","Jascha Samadi is Co-Founder and Partner at Greenfield One (www.greenfield.one), a Berlin-based early-stage venture fund dedicated to blockch...","European Union (EU), Europe, Middle East, and Africa (EMEA)",,,https://www.greenfield.one/,https://www.linkedin.com/in/jaschasamadi/,3,,
Oliver Merkel,https://www.crunchbase.com/person/oliver-merkel,Individual/Angel,3,,"Berlin, Berlin, Germany",,Oliver Merkel is the Co-Founder of Flink Food.,"European Union (EU), Europe, Middle East, and Africa (EMEA)",,,,https://www.linkedin.com/in/oliver-merkel-39283780/,3,,
Manuel Thurner,https://www.crunchbase.com/person/manuel-thurner,Individual/Angel,3,,"Munich, Bayern, Germany",,"Manuel Thurner is the Co-Founder and Co-CEO at Kaia Health. He attended the Technical University of Munich, Massachusetts Institute of Techn...","European Union (EU), Europe, Middle East, and Africa (EMEA)",,,,https://www.linkedin.com/in/manuelth,3,,
Philipp Petrescu,https://www.crunchbase.com/person/philipp-petrescu,Individual/Angel,3,,"Berlin, Berlin, Germany",,Philipp Petrescu is the Co-Founder and CEO of MVP Factory and also the Co-Founder of MVP Match. He previously worked at Lendico as a Co-Foun...,"European Union (EU), Europe, Middle East, and Africa (EMEA)",,,,https://www.linkedin.com/in/philipppetrescu,3,,
Kolja Hebenstreit,https://www.crunchbase.com/person/kolja-hebenstreit,"Individual/Angel, Investment Partner",3,3,"Berlin, Berlin, Germany",Seed,"Co-Founder: Point Nine Capital, Team Europe and Delivery Hero /// Now investing in Startups via Point Nine Capital","European Union (EU), Europe, Middle East, and Africa (EMEA)",,,http://kolja.de,http://www.linkedin.com/in/koljahebenstreit,3,,
Daniel Schütt,https://www.crunchbase.com/person/daniel-schutt,Individual/Angel,3,1,"Bochum, Nordrhein-Westfalen, Germany",Seed,Daniel Schütt is the Co-Founder and CEO of ekko. He previously worked at Bertelsmann SE and Co. KGaA as a CEO Employour GmbH (Territory). Da...,"European Union (EU), Europe, Middle East, and Africa (EMEA)",,,,https://www.linkedin.com/in/danielschuett,2,,
Julian Dames,https://www.crunchbase.com/person/julian-f-dames,Individual/Angel,3,2,"Berlin, Berlin, Germany",,Julian Dames is the co-founder and Managing Director of Flink.,"European Union (EU), Europe, Middle East, and Africa (EMEA)",,,,https://www.linkedin.com/in/julian-dames-99137b19,3,1,
Hannes Ametsreiter,https://www.crunchbase.com/person/hannes-ametsreiter,"Individual/Angel, Investment Partner",3,,"Düsseldorf, Nordrhein-Westfalen, Germany",,Dr Hannes Ametsreiter has been CEO of Vodafone Germany and member of the worldwide Vodafone Group’s Executive Committee since 1 October 2015...,"European Union (EU), Europe, Middle East, and Africa (EMEA)",,,,https://www.linkedin.com/in/hannes-ametsreiter/,2,,
Benjamin Guenther,https://www.crunchbase.com/person/benjamin-gunther,Individual/Angel,3,1,"München, Bayern, Germany",Seed,Benjamin Guenther is the Founder of Alasco.,"European Union (EU), Europe, Middle East, and Africa (EMEA)",,,,https://www.linkedin.com/in/benjaminguenther,3,,
Karl Moritz Hermann,https://www.crunchbase.com/person/karl-moritz-hermann,Individual/Angel,3,,"Berlin, Berlin, Germany",,Karl Moritz Hermann is the Co-Founder and CEO of Reliant AI. He previously worked at Saiga as a CEO. Karl Moritz Hermann attended the Univer...,"European Union (EU), Europe, Middle East, and Africa (EMEA)",,,http://www.karlmoritz.com,https://www.linkedin.com/in/karlmoritz,3,,
Nils Regge,https://www.crunchbase.com/person/nils-regge,Individual/Angel,3,,"Hamburg, Germany, Europe",,"Nils is a serial entrepreneur and company builder with a long-standing passion for health and biomedicine. At Apollo, Nils brings deal makin...","European Union (EU), Europe, Middle East, and Africa (EMEA)",,,,https://www.linkedin.com/in/nils-regge-62ab7a28/,3,,
Josef Brunner,https://www.crunchbase.com/person/josef-brunner,"Individual/Angel, Investment Partner",3,1,"Munich, Bayern, Germany",Seed,"Josef Brunner has a successful track record of starting and growing companies, beginning at age 16 when he founded one of the first unified ...","European Union (EU), Europe, Middle East, and Africa (EMEA)",,,,https://www.linkedin.com/in/josef-brunner-85203915,3,,
Hasu Mr,https://www.crunchbase.com/person/hasu-mr,Individual/Angel,3,,"Germany, Europe",,Hasu is a strategy lead at Flashbots & strategic advisor to Lido.,"European Union (EU), Europe, Middle East, and Africa (EMEA)",,,,,3,,
Fabian Silberer,https://www.crunchbase.com/person/fabian-silberer,Individual/Angel,3,,"Offenburg, Baden-Wurttemberg, Germany",,Fabian Silberer - CEO & Co-Founder @ sevDesk,"European Union (EU), Europe, Middle East, and Africa (EMEA)",,,,https://www.linkedin.com/in/fabian-silberer-8129568/,3,,
Alexander Bruehl,https://www.crunchbase.com/person/alexander-brhl,"Individual/Angel, Investment Partner",3,,"Munich, Bayern, Germany","Crowdfunding, Early Stage Venture, Seed, Venture",Alexander Bruehl is the Founder and Owner of SaaSgarage. He previously worked at Signum Computer as a Realtime Hardware and Software Develop...,"European Union (EU), Europe, Middle East, and Africa (EMEA)",,,,http://www.linkedin.com/in/abruehl,2,1,
Christian Bertermann,https://www.crunchbase.com/person/christian-bertermann,Individual/Angel,3,1,"Berlin, Berlin, Germany",Seed,"Christian Bertermann is the founder and managing director of Auto1.com. Previously, he worked as the vice president of product at Groupon. ...","European Union (EU), Europe, Middle East, and Africa (EMEA)",,,,https://www.linkedin.com/in/christian-bertermann-02513a52,2,,
Ugur Samut,https://www.crunchbase.com/person/ugur-samut,Individual/Angel,3,,"Berlin, Berlin, Germany",,Ugur Samut - Co-Founder & Board Member @ Gorillas,"European Union (EU), Europe, Middle East, and Africa (EMEA)",,,,https://www.linkedin.com/in/ugur-samut-60298558,3,,
Doreen Huber,https://www.crunchbase.com/person/doreen-huber,"Individual/Angel, Investment Partner",3,,"Berlin, Berlin, Germany",Seed,Doreen Huber is a Non Executive Director & Aufsichtsrat at Domino's Pizza Enterprises. He attended  Humboldt University of Berlin.,"European Union (EU), Europe, Middle East, and Africa (EMEA)",,,,http://www.linkedin.com/in/doreenhuber,3,,
Jens Hewald,https://www.crunchbase.com/person/jens-hewald,Individual/Angel,3,,"Berlin, Berlin, Germany",Seed,Jens Hewald is the Co-Founder of Soonami.io and UFOstart. He previously worked at Agrilution as an investor. Jens Hewald attended HTW Berlin...,"European Union (EU), Europe, Middle East, and Africa (EMEA)",,,,https://www.linkedin.com/in/jenshewald,3,,
Benjamin Kremer,https://www.crunchbase.com/person/benjamin-kremer,Individual/Angel,3,,"Munich, Bayern, Germany",,Benjamin Kremer - Founder & CEO @ yfood Labs,"European Union (EU), Europe, Middle East, and Africa (EMEA)",,,,https://www.linkedin.com/in/benjamin-kremer-a0221176/,3,,
Timo Meyer,https://www.crunchbase.com/person/timo-meyer-90ad,Individual/Angel,3,,"Berlin, Berlin, Germany",,Timo Meyer is the Founder & Managing Director at Shio Capital.He attended DSTY.,"European Union (EU), Europe, Middle East, and Africa (EMEA)",,,,https://www.linkedin.com/in/timomeyer/,3,,
Alexander Müller,https://www.crunchbase.com/person/alexander-graubner-mller,Individual/Angel,3,2,"Hamburg, Hamburg, Germany",Seed,"Alexander Graubner-Müller, Co-Founder and CEO of Kreditech, strongly believes that algorithms and statistical data are the building blocks f...","European Union (EU), Europe, Middle East, and Africa (EMEA)",,,,https://www.linkedin.com/in/graubner/en,3,,
Hanno Heintzenberg,https://www.crunchbase.com/person/hanno-heintzenberg,Individual/Angel,3,,"Berlin, Berlin, Germany",,Hanno Heintzenberg is the founder and managing director of MAYD Group.,"European Union (EU), Europe, Middle East, and Africa (EMEA)",,,,https://www.linkedin.com/in/hanno-heintzenberg-65aa25bb,3,,
Nikolaus Nieder,https://www.crunchbase.com/person/nikolaus-nieder,Individual/Angel,3,,"Munich, Bayern, Germany","Early Stage Venture, Late Stage Venture",Nicholas Nieder is an Individual investor.,"European Union (EU), Europe, Middle East, and Africa (EMEA)",,,,https://www.linkedin.com/in/nikolaus-nieder-aa320078/,3,,
Andy Goldstein,https://www.crunchbase.com/person/andy-goldstein,"Individual/Angel, Investment Partner",3,,"Munich, Bayern, Germany",Seed,Andy Goldstein is the Co-Founder and General Partner of A Round Capital GmbH. He previously worked at Deloitte Digital GmbH as a Co-Founder ...,"European Union (EU), Europe, Middle East, and Africa (EMEA)",,,,https://www.linkedin.com/in/andymgoldstein,3,,
Philip Huffmann,https://www.crunchbase.com/person/philip-huffmann,Individual/Angel,3,1,"Berlin, Berlin, Germany",Seed,"Philip Huffmann, born in 1984, is one of the Co-Founders of Helpling. He is responsible for product, IT and operations management. He grew u...","European Union (EU), Europe, Middle East, and Africa (EMEA)",,,,https://www.linkedin.com/in/philip-huffmann-85206918,3,,
Janis Zech,https://www.crunchbase.com/person/janis-zech,Individual/Angel,3,1,"Berlin, Germany, Europe",Seed,Janis Zech is the Founder and CEO at Weflow.,"European Union (EU), Europe, Middle East, and Africa (EMEA)",,,,http://www.linkedin.com/in/janiszech,3,,
Dennis Weidner,https://www.crunchbase.com/person/dennis-weidner,Individual/Angel,3,,"Berlin, Berlin, Germany",,Dennis Weidner is the CEO and founder of ePilot Mobility.,"European Union (EU), Europe, Middle East, and Africa (EMEA)",,,http://dennis-weidner.com/,https://www.linkedin.com/in/dennis-weidner/,3,2,
Philipp Roesch-Schlanderer,https://www.crunchbase.com/person/philip-roesch-schladerer,Individual/Angel,3,,"Munich, Bayern, Germany",Seed,"Philipp was an unsuccessful gym goer and decided to found eGym in 2010 with the vision to make the gym work for everyone. Prior, he studied ...","European Union (EU), Europe, Middle East, and Africa (EMEA)",,,,https://www.linkedin.com/in/philipp-roesch-schlanderer-bb33137/,3,,
Noel Zeh,https://www.crunchbase.com/person/noel-zeh,"Individual/Angel, Investment Partner",3,2,"Munich, Bayern, Germany","Convertible Note, Early Stage Venture, Late Stage Venture, Seed, Venture",Noel Zeh has been a partner at Alstin Capital since June 2020 and has worked in the start-up environment for almost 20 years. He knows best ...,"European Union (EU), Europe, Middle East, and Africa (EMEA)",,,,http://www.linkedin.com/in/noel-zeh-53a202,3,,
Maximilian Odendahl,https://www.crunchbase.com/person/maximilian-odendahl,Individual/Angel,3,,"Cologne, Nordrhein-Westfalen, Germany",,Maximilian Odendahl - CEO & Co-Founder @ Silexica,"European Union (EU), Europe, Middle East, and Africa (EMEA)",,,,https://www.linkedin.com/in/maximilianodendahl/,2,,
Tina Mueller,https://www.crunchbase.com/person/tina-mueller,Individual/Angel,3,,"Germany, Europe",,"Since November 2017, Tina Müller has been chairwoman of the board (CEO) at Douglas GmbH. Previously, she was responsible for strategic brand...","European Union (EU), Europe, Middle East, and Africa (EMEA)",,,,https://www.linkedin.com/in/tina-mueller/,3,1,
Marcel Doeppes,https://www.crunchbase.com/person/marcel-doeppes,"Individual/Angel, Investment Partner",3,,"Frankfurt, Hessen, Germany","Early Stage Venture, Seed",VC-turned-Operator-turned-Angel with 7+ years of experience in the startup and Venture Capital industry.  Currently: Sen. Investment Manage...,"European Union (EU), Europe, Middle East, and Africa (EMEA)",,,,https://www.linkedin.com/in/marceldoeppes,3,,
Olav Sehlbach,https://www.crunchbase.com/person/olav-sehlbach,Individual/Angel,3,1,"Berlin, Berlin, Germany",,"BA4V Partner. With over 25 years experience in the health care sector, Mr. Sehlbach has extensive knowledge of demographic change. As an act...","European Union (EU), Europe, Middle East, and Africa (EMEA)",,,,https://www.linkedin.com/in/olav-sehlbach-22881a205,3,,
Maximilian Thyssen,https://www.crunchbase.com/person/maximilian-thyssen,Individual/Angel,3,,"Berlin, Berlin, Germany",Seed,"Maximilian Thyssen, 34, BA (hons), MBA, is a business angel / VC in the online sector since 2007. In addition to his activities as a Busines...","European Union (EU), Europe, Middle East, and Africa (EMEA)",,,,http://www.linkedin.com/in/maxthyssen,3,,
Benjamin Schroeter,https://www.crunchbase.com/person/benjamin-schroeter,Individual/Angel,3,1,"Hamburg, Germany, Europe",,"Benjamin Schroeter is co-founder and Managing Director of FACELIFT, mainly responsible for all business development. Previously, Benjamin Sc...","European Union (EU), Europe, Middle East, and Africa (EMEA)",,,,https://www.linkedin.com/in/benjamin-schroeter-8670a367,2,1,
Brigitte Zypries,https://www.crunchbase.com/person/brigitte-zypries,Individual/Angel,3,,"Berlin, Berlin, Germany",,"Brigitte Zypries (* 16 November 1953 in Kassel) is a politician (SPD). Brigitte Zypries, as Federal Minister of State, succeeds Sigmar Gabri...","European Union (EU), Europe, Middle East, and Africa (EMEA)",,,,http://de.linkedin.com/pub/null-null/99/232/b25/en,2,,
Emanuel Stehle,https://www.crunchbase.com/person/emanuel-stehle,Individual/Angel,3,1,"Berlin, Berlin, Germany",Seed,"Emanuel Stehle is an Investor, Co-founder, and Member of the Board at Airy. He is also the Founder and CEO of Cerendipity. attended Zeppelin...","European Union (EU), Europe, Middle East, and Africa (EMEA)",,,,https://www.linkedin.com/in/emanuelstehle,2,,
Axel & Boris,https://www.crunchbase.com/person/axel-boris,Individual/Angel,3,1,"Berlin, Berlin, Germany",Seed,Axel & Boris - Investor @ YesssWorks,"European Union (EU), Europe, Middle East, and Africa (EMEA)",,,http://axelboris.com,https://www.linkedin.com/in/axelborisab,3,1,
Dirk Schneider,https://www.crunchbase.com/person/dirk-schneider,Individual/Angel,3,,"Essen, Nordrhein-Westfalen, Germany",,Dirk Schneider is Co-Founder at BackWerk.,"European Union (EU), Europe, Middle East, and Africa (EMEA)",,,,,1,1,
Felix Petersen,https://www.crunchbase.com/person/felix-petersen,Individual/Angel,3,1,"Berlin, Berlin, Germany",Seed,"Felix Petersen is CEO and Co-Founder of [Amen](http://www.amenhq.com), a Service for voicing strong opinions and ranking the world around yo...","European Union (EU), Europe, Middle East, and Africa (EMEA)",,,,http://www.linkedin.com/in/felixpetersen,3,,
Lito Coen,https://www.crunchbase.com/person/lito-coen,Individual/Angel,3,,"Berlin, Berlin, Germany",,Lito Coen is the founder of Cryptotesters,"European Union (EU), Europe, Middle East, and Africa (EMEA)",,,,https://www.linkedin.com/in/emanuelcoen/,3,,
Meir Barel,https://www.crunchbase.com/person/dr-meir-barel,Individual/Angel,3,,"München, Bayern, Germany",Seed,Dr. Barel functions as STAR's Principal Managing Partner and has been engaged in the international venture capital business for the past 20 ...,"European Union (EU), Europe, Middle East, and Africa (EMEA)",,,,https://www.linkedin.com/in/meir-barel-6941171a,2,,
Alexander Brand,https://www.crunchbase.com/person/alexander-brand,"Individual/Angel, Investment Partner",3,1,"Munich, Bayern, Germany",Seed,"Alexander Brand is a co-founder and the managing director of [Windeln.de](https://www.crunchbase.com/organization/windeln-de#/entity), an on...","European Union (EU), Europe, Middle East, and Africa (EMEA)",,,,https://www.linkedin.com/in/brandalexander/,3,,
Wolfgang Heigl,https://www.crunchbase.com/person/wolfgang-heigl,"Individual/Angel, Investment Partner",3,1,"Munich, Bayern, Germany",Seed,Wolfgang founded NFQ back in 2002 – originally purely as a technology company to support his various ventures. He has found success as bo...,"European Union (EU), Europe, Middle East, and Africa (EMEA)",,,,https://www.linkedin.com/in/wolfgang-heigl-26813953/,3,,
Marcus Diekmann,https://www.crunchbase.com/person/marcus-diekmann,Individual/Angel,3,,"Coesfeld, Nordrhein-Westfalen, Germany",,Marcus Diekmann,"European Union (EU), Europe, Middle East, and Africa (EMEA)",,,,https://www.linkedin.com/in/marcus-diekmann/,3,,
Jenny Saft,https://www.crunchbase.com/person/jenny-saft,Individual/Angel,3,,"Berlin, Berlin, Germany",,Jenny Saft is the Co-Founder and Managing Director at OVIAVO. She attended Hult International Business School during 2013 - 2014.,"European Union (EU), Europe, Middle East, and Africa (EMEA)",,,,https://www.linkedin.com/in/jennysaft,3,,
Philipp Magin,https://www.crunchbase.com/person/philipp-magin,Individual/Angel,3,1,"Berlin, Berlin, Germany",Seed,Philipp Magin is the Founder and Group Managing Director of The Sublime Group and Founder and Managing Partner of Prime Properties Group. He...,"European Union (EU), Europe, Middle East, and Africa (EMEA)",,,,https://www.linkedin.com/in/philippmagin,2,,
Peter Lindholm,https://www.crunchbase.com/person/peter-lindholm,Individual/Angel,3,,"Berlin, Berlin, Germany",,Peter Lindholm is COO and co-founder at Frontier Car Group. He was formally working within Kinnevik companies for last 6 years. He managed t...,"European Union (EU), Europe, Middle East, and Africa (EMEA)",,,,https://www.linkedin.com/in/lindholmpeter/,3,,
