Ericsson Ventures,https://www.crunchbase.com/organization/ericsson-ventures,Corporate Venture Capital,36,9,"Santa Clara, California, United States","Early Stage Venture, Late Stage Venture",Ericsson Ventures is a venture capital and private equity firm that invests in innovative companies.,"San Francisco Bay Area, Silicon Valley, West Coast",1876-01-01,year,http://www.ericsson.com/ventures,https://www.linkedin.com/company/ericsson/,31,4,1
American Capital,https://www.crunchbase.com/organization/american-capital,"Private Equity Firm, Venture Capital, Venture Debt",36,18,"Bethesda, Maryland, United States","Debt, Early Stage Venture, Late Stage Venture","American Capital  with $20 billion in capital resources under management,1 is the only private equity fund and the largest.","Washington DC Metro Area, East Coast, Southern US",1997-01-01,year,http://www.americancapital.com,https://www.linkedin.com/company/american-capital,29,23,2
Kal Vepuri,https://www.crunchbase.com/person/kal-vepuri,"Individual/Angel, Investment Partner",36,11,"New York, New York, United States",Seed,Kal Vepuri is Founder and Chairman of Brainchild. Brainchild Holdings is Kal's personal direct investment vehicle. Brainchild & Company is a...,"Greater New York Area, East Coast, Northeastern US",,,http://www.brainchildholdings.com,http://www.linkedin.com/in/kalvepuri,33,,
Peak 6,https://www.crunchbase.com/organization/peak6-investments,"Fund Of Funds, Private Equity Firm, Venture Capital, Venture Debt",35,7,"Chicago, Illinois, United States","Convertible Note, Debt, Early Stage Venture, Late Stage Venture, Private Equity, Venture",Peak6 Investments operates as an investment management firm.,"Greater Chicago Area, Great Lakes, Midwestern US",1997-01-01,year,https://www.peak6.com,https://www.linkedin.com/company/peak6-investments/,29,10,3
Studio VC,https://www.crunchbase.com/organization/studio-vc,Micro VC,35,7,"New York, New York, United States","Early Stage Venture, Seed",Studio VC is an early stage investment fund that provides capital and hands-on guidance to growing companies with breakout potential.,"Greater New York Area, East Coast, Northeastern US",2016-08-01,month,http://www.Studio.VC,https://www.linkedin.com/company/studio-vc/about/,31,3,
KCK,https://www.crunchbase.com/organization/kck,Family Investment Office,35,5,"New York, New York, United States","Early Stage Venture, Late Stage Venture","KCK is a family investment fund that invests in a diverse set of industries, including medical technologies.","Greater New York Area, East Coast, Northeastern US",2015-01-01,year,,,20,16,4
Ride Ventures,https://www.crunchbase.com/organization/ride-ventures,"Angel Group, Venture Capital",35,5,"La Jolla, California, United States","Early Stage Venture, Seed, Venture",Ride Ventures is an early-stage technology venture capital investment firm that invests in the different technology sectors.,"Greater San Diego Area, West Coast, Western US",2016-01-01,year,,https://www.linkedin.com/company/ride-ventures/,31,,
Ihar Mahaniok,https://www.crunchbase.com/person/ihar-mahaniok,"Individual/Angel, Investment Partner",35,13,"New York, New York, United States","Early Stage Venture, Seed",Ihar Mahaniok is the Managing Partner at Geek Ventures. Ihar Mahaniok attended Belarusian State University.,"Greater New York Area, East Coast, Northeastern US",,,http://geek-ventures.com/,http://www.linkedin.com/in/mahaniok,35,,
Divergent Ventures,https://www.crunchbase.com/organization/divergent-ventures,Micro VC,35,15,"Seattle, Washington, United States","Early Stage Venture, Late Stage Venture, Seed",Divergent Ventures is an American venture capital firm that funds early-stage companies in the cloud computing and big data sectors.,"Greater Seattle Area, West Coast, Western US",2006-01-01,year,http://www.divergentvc.com,http://www.linkedin.com/company/divergent-ventures,20,4,
Howard Lindzon,https://www.crunchbase.com/person/howard-lindzon,"Individual/Angel, Investment Partner",35,11,"San Diego, California, United States",Seed,Howard Lindzon - Founder & General Partner @ Social Leverage,"Greater San Diego Area, West Coast, Western US",,,https://18salisbury.capital,http://www.linkedin.com/in/howardlindzon,34,1,1
Citrix Startup Accelerator,https://www.crunchbase.com/organization/citrix-startup-accelerator,Accelerator,35,8,"Santa Clara, California, United States","Early Stage Venture, Seed",Citrix Startup Accelerator is an early-stage investor that invests in enterprise start-ups.,"San Francisco Bay Area, Silicon Valley, West Coast",2010-12-01,day,http://citrixstartupaccelerator.com,,31,7,
Silicon Pastures,https://www.crunchbase.com/organization/silicon-pastures,Angel Group,35,7,"Milwaukee, Wisconsin, United States","Early Stage Venture, Seed",Silicon Pastures is an angel investment network that provides entrepreneurs with funds and expertise to build businesses.,"Great Lakes, Midwestern US",2000-01-01,year,http://www.siliconpastures.com,https://www.linkedin.com/company/silicon-pastures-llc,31,6,
Trog Hawley Capital,https://www.crunchbase.com/organization/trog-hawley-capital,Family Investment Office,35,6,"West Palm Beach, Florida, United States","Convertible Note, Early Stage Venture, Late Stage Venture, Private Equity, Venture","Trog Hawley Capital is a single-family office in West Palm Beach, Florida.","Greater Miami Area, East Coast, Southern US",2012-01-01,year,http://troghawley.com/,https://www.linkedin.com/company/trog-hawley-capital-llc,27,2,2
InveStar Capital,https://www.crunchbase.com/organization/investar-capital,"Family Investment Office, Venture Capital",35,16,"San Jose, California, United States","Convertible Note, Early Stage Venture, Late Stage Venture, Venture","InveStar Capital, Inc. was a Early State VC with offices in the US and Taiwan. Converted Into Kenneth Tai's personal Family Office in 2007.","San Francisco Bay Area, Silicon Valley, West Coast",1996-01-01,year,http://www.investar-cap.com.tw,https://www.linkedin.com/company/investar-capital/,24,6,6
Social Discovery Group,https://www.crunchbase.com/organization/social-discovery-ventures,"Corporate Venture Capital, Incubator, Venture Capital",34,5,"New York, New York, United States","Convertible Note, Early Stage Venture, Late Stage Venture, Seed, Venture","SDGroup brings together over 50 brands, an investment fund and a venture studio. We invest in social discovery technology startups.","Greater New York Area, East Coast, Northeastern US",1991-01-01,year,https://socialdiscoverygroup.com/,https://www.linkedin.com/company/social-discovery-ventures,29,8,
Gotham Gal Ventures,https://www.crunchbase.com/organization/gotham-gal-ventures,"Angel Group, Venture Capital",34,6,"New York, New York, United States","Early Stage Venture, Seed, Venture",Gotham Gal Ventures is a venture capital firm that invests in all sectors of companies in the US.,"Greater New York Area, East Coast, Northeastern US",2008-01-01,year,https://gothamgal.com,,33,,
Assurant Ventures,https://www.crunchbase.com/organization/assurant-growth-investing,Corporate Venture Capital,34,6,"Atlanta, Georgia, United States","Early Stage Venture, Late Stage Venture",Assurant Ventures focused on making equity investments in venture and growth stage technology companies.,"Greater Atlanta Area, East Coast, Southern US",2015-01-01,year,https://www.assurant.com/partner-with-us/partnerships/ventures,https://www.linkedin.com/company/assurantventures,26,3,2
Taiho Ventures,https://www.crunchbase.com/organization/taiho-ventures-2,Corporate Venture Capital,34,6,"California City, California, United States","Early Stage Venture, Late Stage Venture, Seed, Venture",Taiho Ventures is a company that specializes in the research and development of pharmaceuticals.,"West Coast, Western US",2016-01-01,year,http://www.taihoventures.com,,23,10,5
Chris Dixon,https://www.crunchbase.com/person/chris-dixon,"Individual/Angel, Investment Partner",34,13,"New York, New York, United States",Seed,"Chris Dixon is a general partner at Andreessen Horowitz and co-leads its $350M crypto fund. Previously, Chris was the cofounder and CEO of t...","Greater New York Area, East Coast, Northeastern US",,,https://18salisbury.capital,https://www.linkedin.com/in/chris-dixon-9599b127b,33,,
Paul Sethi,https://www.crunchbase.com/person/paul-sethi,"Individual/Angel, Investment Partner",34,13,"New York, New York, United States","Private Equity, Seed, Venture","Paul Sethi is a co-founder and Managing Partner at 2048 Ventures, the Founder and Managing Partner at Trajectory Capital Partners, and the C...","Greater New York Area, East Coast, Northeastern US",,,https://TrajectoryCapital.com,http://www.linkedin.com/in/paulsethi,29,,
High Country Venture,https://www.crunchbase.com/organization/high-country-venture,Micro VC,34,6,"Boulder, Colorado, United States","Early Stage Venture, Late Stage Venture, Seed",The Colorado Fund is a venture capital fund seeking to invest in seed and early stage businesses in Colorado.,"Greater Denver Area, Western US",2005-01-01,year,http://highcountryventure.com,https://www.linkedin.com/company/high-country-ventures,17,9,1
The Startup Factory,https://www.crunchbase.com/organization/the-startup-factory,Accelerator,34,5,"Durham, North Carolina, United States","Early Stage Venture, Seed",The Startup Factory is the SE's best funded and operating accelerator.,"Research Triangle, East Coast, Southern US",,,http://thestartupfactory.co,https://www.linkedin.com/company/the-startup-factory/,31,,
Dave Gilboa,https://www.crunchbase.com/person/david-gilboa,"Individual/Angel, Investment Partner",34,6,"New York, New York, United States",Seed,Dave Gilboa is the Co-Founder and Co-CEO of Warby Parker. He attended the Wharton School.,"Greater New York Area, East Coast, Northeastern US",,,,http://www.linkedin.com/in/davegilboa,33,,
Joi Ito,https://www.crunchbase.com/person/joi-ito,"Individual/Angel, Investment Partner",34,11,"Cambridge, Massachusetts, United States","Early Stage Venture, Seed",Joichi Ito is a Parttime Lecturer at Chiba Institute of Technology. he attended Keio University in 2018.,"Greater Boston Area, East Coast, New England",,,http://joi.ito.com,http://www.linkedin.com/in/joiito,32,,
Jack Dorsey,https://www.crunchbase.com/person/jack-dorsey,"Individual/Angel, Investment Partner",33,6,"San Francisco, California, United States",Seed,"Jack Dorsey is the Co-Founder and CEO of Block, Inc. He previously worked at Elliott Investment Management as a CEO.","San Francisco Bay Area, West Coast, Western US",,,,https://www.linkedin.com/in/jack-dorsey-a43b07242,27,6,
Lavrock Ventures,https://www.crunchbase.com/organization/lavrock-ventures,Micro VC,33,6,"Mclean, Virginia, United States","Early Stage Venture, Late Stage Venture, Seed",Lavrock Ventures is venture capital firm.,"Washington DC Metro Area, East Coast, Southern US",2015-01-01,year,http://www.lavrockvc.com,https://www.linkedin.com/company/lavrock-ventures,23,14,
East West Bank,https://www.crunchbase.com/organization/east-west-bank,Venture Debt,33,17,"Pasadena, California, United States","Debt, Early Stage Venture, Post-Ipo, Seed, Venture","East West Bancorp is a publicly owned company with $22 billion in assets. The Company’s wholly owned subsidiary, East West Bank, is one of","Greater Los Angeles Area, West Coast, Western US",1998-01-01,year,http://eastwestbank.com,http://www.linkedin.com/company/14528,30,13,12
Howard Morgan,https://www.crunchbase.com/person/howard-morgan,"Individual/Angel, Investment Partner",33,7,"New York, New York, United States",Seed,Howard Morgan is currently the Chairman of B Capital. He co-founded First Round Capital with Josh Kopelman as the first professional Seed St...,"Greater New York Area, East Coast, Northeastern US",,,,http://www.linkedin.com/in/hlmorgan,29,3,
Owen Van Natta,https://www.crunchbase.com/person/owen-van-natta,"Individual/Angel, Investment Partner",33,13,"San Francisco, California, United States",Seed,"Owen Van Natta is currently Founder and Managing Partner of Prefix Capital, an early stage investment fund founded in 2019. Owen is also a F...","San Francisco Bay Area, West Coast, Western US",,,https://18salisbury.capital,https://www.linkedin.com/in/owen-van-natta-444a7/,29,1,3
Jeff Kearl,https://www.crunchbase.com/person/jeff-kearl,"Individual/Angel, Investment Partner",33,16,"San Clemente, California, United States","Early Stage Venture, Seed",Jeff Kearl is a Managing Director at Pelion Ventures. He previously served as the Chief Executive Officer and Chairman of Stance. He previou...,"Greater Los Angeles Area, West Coast, Western US",,,,https://www.linkedin.com/in/jeffkearl,30,,5
Dan Rose,https://www.crunchbase.com/person/dan-rose,"Individual/Angel, Investment Partner",33,9,"Palo Alto, California, United States",Seed,Dan Rose is the Chairman of Coatue Management.,"San Francisco Bay Area, Silicon Valley, West Coast",,,,http://www.linkedin.com/in/dlrose,31,,2
Brandtech Ventures,https://www.crunchbase.com/organization/you-mr-jones-brandtech-ventures,Corporate Venture Capital,33,11,"New York, New York, United States","Early Stage Venture, Late Stage Venture, Seed, Venture","Brandtech Ventures is the venture investment arm of The Brandtech Group (formerly You & Mr Jones), a marketing technology group.","Greater New York Area, East Coast, Northeastern US",2015-06-11,day,https://thebrandtechgroup.com/,https://www.linkedin.com/company/the-brandtech-group/,25,10,1
Duchossois Technology Partners,https://www.crunchbase.com/organization/duchossois-technology-partners,"Family Investment Office, Private Equity Firm",33,10,"Elmhurst, Illinois, United States","Early Stage Venture, Late Stage Venture","Duchossois Technology Partners (DTEC) is a venture capital firm investing in early, mid, and growth stages of high potential technology","Greater Chicago Area, Great Lakes, Midwestern US",1998-01-01,year,http://www.dcmllc.com/,https://www.linkedin.com/company/duchossois-capital-partners/about/,17,6,3
John Thompson,https://www.crunchbase.com/person/john-w-thompson,"Individual/Angel, Investment Partner",33,7,"San Francisco, California, United States",Seed,John Thompson currently works as the Venture Partner for Lightspeed Venture Partners.  He previously worked at Riverwood Capital Management ...,"San Francisco Bay Area, West Coast, Western US",,,,https://www.linkedin.com/in/jthompson16/,24,1,
Geoff Entress,https://www.crunchbase.com/person/geoff-entress,"Individual/Angel, Investment Partner",33,14,"Pittsburgh, Pennsylvania, United States",Seed,Geoff Entress is a Managing Director and Co-Founder of PSL. He was formerly a venture partner with Voyager Capital and Madrona Venture Group...,"Great Lakes, Northeastern US",,,,https://www.linkedin.com/in/geoffentress,32,,2
Kelly Perdew,https://www.crunchbase.com/person/kelly-perdew,"Individual/Angel, Investment Partner",33,11,"Los Angeles, California, United States","Early Stage Venture, Seed",Co-Founder & Managing General Partner at Moonshots Capital.,"Greater Los Angeles Area, West Coast, Western US",,,http://www.kellyperdew.com,http://www.linkedin.com/in/kellyperdew,31,1,3
Draft Ventures,https://www.crunchbase.com/organization/draft-ventures,"Incubator, Venture Capital",33,5,"San Francisco, California, United States","Early Stage Venture, Seed, Venture",Draft Ventures is a collaborative online investment fund that finances early stage investments.,"San Francisco Bay Area, West Coast, Western US",2015-03-01,day,http://draftvc.com,https://www.linkedin.com/company/draft-ventures,31,1,
Adeyemi Ajao,https://www.crunchbase.com/person/adeyemi-ajao,"Individual/Angel, Investment Partner",33,16,"San Francisco, California, United States",Seed,"Adeyemi (“Ade”) is the Co-founder and Managing Partner of Base10 Partners. Before Base10, Ade had a successful career as an entrepreneur and...","San Francisco Bay Area, West Coast, Western US",,,,http://www.linkedin.com/in/adeyemiajao,31,,2
Roger Ehrenberg,https://www.crunchbase.com/person/roger-ehrenberg,"Individual/Angel, Investment Partner",33,16,"New York, New York, United States","Early Stage Venture, Seed","Roger Ehrenberg is the founder and Managing Partner of IA Ventures, a firm that invests in companies creating competitive advantage through ...","Greater New York Area, East Coast, Northeastern US",,,https://medium.com/@infoarbitrage,http://www.linkedin.com/in/rehrenberg,31,2,1
OSF Ventures,https://www.crunchbase.com/organization/osf-ventures,Corporate Venture Capital,32,8,"Peoria, Illinois, United States","Early Stage Venture, Late Stage Venture, Venture",OSF strategically invest in the development of technology and devices that could improve health care,"Great Lakes, Midwestern US",2015-01-01,year,https://www.osfhealthcare.org/ventures/,https://www.linkedin.com/company-beta/973835/,26,7,1
Empire Angels,https://www.crunchbase.com/organization/empire-angels,"Angel Group, Micro VC",32,7,"New York, New York, United States","Debt, Early Stage Venture, Late Stage Venture, Seed, Venture","Empire Angels is a Member-led, NYC seed fund and angel group of young professionals investing in early-stage ventures.","Greater New York Area, East Coast, Northeastern US",2012-06-01,day,http://www.empireangels.com,http://www.linkedin.com/company/empire-angels,25,2,1
Maiden Lane Ventures,https://www.crunchbase.com/organization/maiden-lane-ventures,"Micro VC, Venture Capital",32,9,"San Francisco, California, United States",Seed,"Maiden Lane Ventures is a San Francisco-based, online venture capital fund that invests in Angel List syndicates.","San Francisco Bay Area, West Coast, Western US",2014-03-14,day,https://www.maidenlane.com/,https://www.linkedin.com/company/maiden-lane,26,,
Ohio TechAngels Fund,https://www.crunchbase.com/organization/ohio-techangels-fund,Angel Group,32,5,"Columbus, Ohio, United States","Early Stage Venture, Seed","Ohio TechAngel Funds (OTAF) provide investment capital for commercialization of innovations in IT, life sciences, and adv materials.","Great Lakes, Midwestern US",2004-12-31,day,http://www.ohiotechangels.com,https://www.linkedin.com/company/ohio-techangel-funds/,26,7,
Sorenson Ventures,https://www.crunchbase.com/organization/sorenson-ventures,"Accelerator, Venture Capital",32,5,"Lehi, Utah, United States","Early Stage Venture, Seed",Sorenson Ventures focuses on accelerating innovations in the software and security sectors.,Western US,2017-01-01,year,https://www.sorensoncapital.com,https://www.linkedin.com/company/sorenson-ventures/,27,16,
Red Bear Angels,https://www.crunchbase.com/organization/red-bear-angels,Angel Group,32,5,"New York, New York, United States","Early Stage Venture, Seed",Red Bear Angels is an investment management company that supports early-stage companies.,"Greater New York Area, East Coast, Northeastern US",2014-01-01,day,http://rbangels.com,https://www.linkedin.com/company/red-bear-angels,24,3,
Ling Wong,https://www.crunchbase.com/person/ling-wong,"Individual/Angel, Investment Partner",32,6,"Seattle, Washington, United States",,Dr. Ling Wong is Founder and General Partner of Highbury Group and Sea Lane Ventures. She also serves as Senior Advisor to Lightspeed Ventur...,"Greater Seattle Area, West Coast, Western US",,,http://www.lingwong.com,https://www.linkedin.com/in/lingwong1,25,,6
Kristian Andersen,https://www.crunchbase.com/person/kristian-andersen,"Individual/Angel, Investment Partner",32,11,"Indianapolis, Indiana, United States","Early Stage Venture, Seed",Kristian  Andersen is a co-founder and partner at High Alpha and was a Co-founder at Octiv. He attended Anderson University.,"Great Lakes, Midwestern US",,,http://www.kristian.vc,http://www.linkedin.com/in/kandersen1,31,,
Infinity Capital,https://www.crunchbase.com/organization/infinity-capital,Micro VC,32,9,"Menlo Park, California, United States","Early Stage Venture, Late Stage Venture","Infinity Capital is an independent, alternative investment management firm focusing on maximizing returns relative to risk.","San Francisco Bay Area, Silicon Valley, West Coast",,,http://www.infinityllc.com,https://www.linkedin.com/in/samhlee1,20,3,
"Fletcher Spaght, Inc.",https://www.crunchbase.com/organization/fletcher-spaght-inc,Micro VC,32,10,"Boston, Massachusetts, United States","Debt, Early Stage Venture, Late Stage Venture","Fletcher Spaght, Inc. provides strategy and financial assistance to new ventures including start-ups.","Greater Boston Area, East Coast, New England",1983-07-19,day,http://www.fletcherspaght.com,https://www.linkedin.com/company/fletcher-spaght,18,3,2
Northwest Venture Associates,https://www.crunchbase.com/organization/northwest-venture-associates,Micro VC,32,11,"Spokane, Washington, United States","Early Stage Venture, Late Stage Venture","NWVA works alongside great entrepreneurs and managers to build valuable enterprises through internal growth, mergers and acquisitions.","West Coast, Western US",,,http://www.nwva.com,,19,7,1
FA Technology Ventures,https://www.crunchbase.com/organization/fa-technology-ventures,Micro VC,32,15,"Waltham, Massachusetts, United States","Early Stage Venture, Late Stage Venture","FA Technology Ventures is an early stage investor, providing venture capital, management and guidance for companies in the emerging growth","Greater Boston Area, East Coast, New England",1994-01-01,year,http://www.fatechventures.com,https://www.linkedin.com/company/fa-technology-ventures/about/,20,2,4
I2A Fund,https://www.crunchbase.com/organization/i2a-fund,Micro VC,32,13,"Chicago, Illinois, United States","Debt, Early Stage Venture, Late Stage Venture, Seed",I2A is a seed venture capital fund that catalyzes and partners with entrepreneurial companies in the Illinois region.,"Greater Chicago Area, Great Lakes, Midwestern US",2007-01-01,year,http://www.i2afund.com,,18,7,
Bluestein Ventures,https://www.crunchbase.com/organization/bluestein-associates,"Family Investment Office, Venture Capital",32,5,"Chicago, Illinois, United States","Early Stage Venture, Seed","Bluestein is a family-backed VC that invests in the future of food. The firm focuses across high-growth CPG, food tech, commerce, & digital.","Greater Chicago Area, Great Lakes, Midwestern US",2009-01-01,year,https://www.bluesteinventures.com/,https://www.linkedin.com/company/bluestein-associates/,29,3,1
MemorialCare Innovation Fund,https://www.crunchbase.com/organization/memorialcare-innovation-fund,"Micro VC, Venture Capital",32,10,"Long Beach, California, United States",Early Stage Venture,"MCIF provides strategic investment funding to privately held healthcare companies offering innovative products, services and technologies.","Greater Los Angeles Area, West Coast, Western US",1993-01-01,year,http://www.memorialcareinnovationfund.com,https://www.linkedin.com/company/memorialcare-health-system/?originalSubdomain=ph,27,10,
Waterfall Asset Management,https://www.crunchbase.com/organization/waterfall-asset-management,"Venture Capital, Venture Debt",31,6,"New York, New York, United States",,A New York-based credit adviser,"Greater New York Area, East Coast, Northeastern US",2005-01-01,year,http://www.waterfallam.com,https://www.linkedin.com/company/waterfall-asset-management-llc,26,19,2
Western Digital Capital,https://www.crunchbase.com/organization/western-digital-capital,"Corporate Venture Capital, Venture Capital",31,13,"Irvine, California, United States","Early Stage Venture, Late Stage Venture","Western Digital Capital works with innovative startups to change how data is generated, saved, managed, and consumed.","Greater Los Angeles Area, West Coast, Western US",2000-08-26,day,http://www.westerndigitalcapital.com,,27,8,1
Stanley Ventures,https://www.crunchbase.com/organization/stanley-ventures,"Corporate Venture Capital, Venture Capital",31,5,"Boston, Massachusetts, United States","Early Stage Venture, Late Stage Venture, Seed, Venture","Stanley Ventures invests in innovative startups and provides industry expertise, supplier relationships, and access to customers.","Greater Boston Area, East Coast, New England",2016-01-01,day,https://www.stanleyventures.com,https://www.linkedin.com/company/stanleyventures/,25,16,1
Ridgeback Capital,https://www.crunchbase.com/organization/ridgeback-capital,"Family Investment Office, Private Equity Firm, Venture Capital",31,20,"New York, New York, United States","Convertible Note, Early Stage Venture, Late Stage Venture, Post-Ipo, Secondary Market, Seed",Ridgeback Capital is a private investment company that is focused on investing in life science companies.,"Greater New York Area, East Coast, Northeastern US",2006-01-01,year,http://www.ridgebackcap.com,https://www.linkedin.com/company/ridgebackcap,28,7,17
Gravity Ventures,https://www.crunchbase.com/organization/gravity-ventures,Angel Group,31,6,"Indianapolis, Indiana, United States","Early Stage Venture, Seed",Gravity Ventures is a member managed seed capital fund investing in early stage technology and tech-enabled businesses.,"Great Lakes, Midwestern US",2008-12-15,day,http://www.gravityventures.com,https://www.linkedin.com/company/gravity-ventures-llc/about/,28,1,
Lauren DeLuca,https://www.crunchbase.com/person/lauren-deluca-3ac9,"Individual/Angel, Investment Partner",31,10,"Chicago, Illinois, United States","Early Stage Venture, Seed","Lauren DeLuca is a Founder and Managing Partner of Motivate Venture Capital, a Chicago-based Pre-Seed and Seed investor. He co-founded a fa...","Greater Chicago Area, Great Lakes, Midwestern US",,,,https://www.linkedin.com/in/delucalauren,31,,1
West Capital Advisors,https://www.crunchbase.com/organization/west-capital-advisors-llc,Family Investment Office,31,11,"Chicago, Illinois, United States","Early Stage Venture, Late Stage Venture",West Capital Advisors provides venture and strategic development advisory services.,"Greater Chicago Area, Great Lakes, Midwestern US",2011-01-01,year,http://www.westcapadv.com,https://www.linkedin.com/company/west-capital-advisors-llc,14,1,1
