Andreas Wuerfel,https://www.crunchbase.com/person/andreas-wuerfel,Individual/Angel,2,,"Düsseldorf, Nordrhein-Westfalen, Germany",Seed,"Andreas Wuerfel is CEO of HoReCa.digital Inc., the US subsidiary of Germany-based HoReCa.digital GmbH. Established by METRO AG, HoReCa Digit...","European Union (EU), Europe, Middle East, and Africa (EMEA)",,,,https://www.linkedin.com/in/andreaswuerfel,1,,
Julia Bosch,https://www.crunchbase.com/person/julia-bsch,Individual/Angel,2,,"Berlin, Berlin, Germany",,"Julia Bosch Originally from beautiful Bodensee, Julia studied business studies in Munich, Madrid and New York. Before starting Outfittery wi...","European Union (EU), Europe, Middle East, and Africa (EMEA)",,,,https://www.linkedin.com/in/julia-b%C3%B6sch-06652a4/,2,,
Claas Nieraad,https://www.crunchbase.com/person/claas-nieraad,Individual/Angel,2,,"Hamburg, Hamburg, Germany",Seed,"Claas started his career at AEG and Electrolux Group, holds a dual degree in international management and finance, from the Intermas and Cal...","European Union (EU), Europe, Middle East, and Africa (EMEA)",,,,https://www.linkedin.com/in/claas-h-nieraad-36652b/,2,,
Dirk Abendroth,https://www.crunchbase.com/person/dirk-abendroth,Individual/Angel,2,,"Frankfurt, Hessen, Germany",,Dirk Abendroth is the CEO at Customcells. He was the CTO Team Global and CEO Startup in Stealth Mode at Team Global. Dirk attended Hamburg U...,"European Union (EU), Europe, Middle East, and Africa (EMEA)",,,,https://www.linkedin.com/in/dr-dirk-abendroth,1,,
Peter Bruhn,https://www.crunchbase.com/person/peter-bruhn,Individual/Angel,2,,"Weiterstadt, Hessen, Germany",,"Peter Bruhn is a Senior Digital Leader and Digital Transformation Specialist. His experience includes Senior Digital Advisor at TAKKT AG, Co...","European Union (EU), Europe, Middle East, and Africa (EMEA)",,,,https://www.linkedin.com/in/bruhnpeter/,2,,
Benedikt Sauter,https://www.crunchbase.com/person/benedikt-sauter,Individual/Angel,2,,"Augsburg, Bayern, Germany",,Benedikt Sauter is the CEO of Xentral ERP Software GmbH.,"European Union (EU), Europe, Middle East, and Africa (EMEA)",,,,https://www.linkedin.com/in/benedikt-sauter-b2a7b170/,2,,
Frank Biedka,https://www.crunchbase.com/person/frank-biedka,Individual/Angel,2,1,"Berlin, Berlin, Germany",Seed,Frank Biedka is the Chief Technology Officer at Elkaso.,"European Union (EU), Europe, Middle East, and Africa (EMEA)",,,,https://www.linkedin.com/in/frank-biedka-8320225,2,,
Johannes Roggendorf,https://www.crunchbase.com/person/johannes-roggendorf,Individual/Angel,2,,"Berlin, Berlin, Germany",,Johannes Roggendorf is the founder and CEO at Medwing.,"European Union (EU), Europe, Middle East, and Africa (EMEA)",,,,https://www.linkedin.com/in/johannes-roggendorf-b2a75443/,2,,
Michael Gutsmann,https://www.crunchbase.com/person/michael-gutsmann,Individual/Angel,2,,"Hamburg, Germany, Europe",Seed,Michael Gutsmann is a CFO at Bigpoint.,"European Union (EU), Europe, Middle East, and Africa (EMEA)",,,,http://www.linkedin.com/in/michaelgutsmann,1,,
Udo Jung,https://www.crunchbase.com/person/udo-jung,Individual/Angel,2,,"Friedrichsdorf, Hessen, Germany",,Dr. Jung was a senior partner at the Boston Consulting Group (BCG) from 1990 to 2019. He founded and led both the chemical and petrochemical...,"European Union (EU), Europe, Middle East, and Africa (EMEA)",,,,https://www.linkedin.com/in/dr-udo-jung-00689a153/details/experience/,2,,
Martin Reitenspiess,https://www.crunchbase.com/person/martin-reitenspiess,"Individual/Angel, Investment Partner",2,,"Munich, Bayern, Germany",Seed,Martin Reitenspiess is an angel investor and currently a partner at Oliver Wyman.,"European Union (EU), Europe, Middle East, and Africa (EMEA)",,,,https://www.linkedin.com/in/martin-reitenspiess-8420aa24/?original_referer=https%3A%2F%2Fwww%2Egoogle%2Ecom%2F&originalSubdomain=de,2,,
Patrick Hennig,https://www.crunchbase.com/person/patrick-hennig,Individual/Angel,2,,"Berlin, Berlin, Germany",,Patrick Hennig is the current CEO and Co-Founder of neXenio. He previously worked at Hasso Plattner Institute as a scientific Assistant. Pat...,"European Union (EU), Europe, Middle East, and Africa (EMEA)",,,,https://www.linkedin.com/in/patrick-hennig-67898372,2,,
Artjem Weissbeck,https://www.crunchbase.com/person/artjem-weissbeck,Individual/Angel,2,,"Berlin, Berlin, Germany",,"Artjem Weissbeck is the Founder, co-CEO, and Managing Director of Charles.","European Union (EU), Europe, Middle East, and Africa (EMEA)",,,,https://www.linkedin.com/in/addy,2,,
Nikita Fahrenholz,https://www.crunchbase.com/person/nikita-fahrenholz,Individual/Angel,2,1,"Berlin, Berlin, Germany",Seed,Nikita Fahrenholz is the CEO and Founder at Actio.,"European Union (EU), Europe, Middle East, and Africa (EMEA)",,,,https://www.linkedin.com/in/nfahrenholz,2,,
Gesa Miczaika,https://www.crunchbase.com/person/gesa-miczaika,"Individual/Angel, Investment Partner",2,,"Berlin, Berlin, Germany",,Gesa Miczaika joined Auxxo as founder.,"European Union (EU), Europe, Middle East, and Africa (EMEA)",,,,https://www.linkedin.com/in/dr-gesa-miczaika-56b5891/,2,,
Andrew Shaw,https://www.crunchbase.com/person/andrew-shaw-2,"Individual/Angel, Investment Partner",2,1,"Berlin, Germany, Europe","Early Stage Venture, Seed","Andrew Shaw founded Comet Rocks, building the future of embedded commerce. 2016-2021 founded Coya AG, a fully licensed German P&C insurance...","European Union (EU), Europe, Middle East, and Africa (EMEA)",,,,https://www.linkedin.com/in/andrewshaw4/,2,,
Alexander Marten,https://www.crunchbase.com/person/alexander-marten,Individual/Angel,2,,"Düsseldorf, Nordrhein-Westfalen, Germany",Seed,Chief Innovation Evangelist at Deutsche Telekom.,"European Union (EU), Europe, Middle East, and Africa (EMEA)",,,,https://www.linkedin.com/in/alexandermarten,2,,
Peter Grosskopf,https://www.crunchbase.com/person/peter-grosskopf-2,Individual/Angel,2,,"Berlin, Berlin, Germany",,Peter Grosskopf is the Co-Founder and CTO at Ultimate. Peter Grosskopf attended the University of Münster.,"European Union (EU), Europe, Middle East, and Africa (EMEA)",,,,https://www.linkedin.com/in/petergrosskopf,2,,
Vladimir Danila,https://www.crunchbase.com/person/vladimir-danila,Individual/Angel,2,,"Mannheim, Baden-Wurttemberg, Germany",,Vladimir Danila is the co-founder and CEO at Linearity.,"European Union (EU), Europe, Middle East, and Africa (EMEA)",,,,https://www.linkedin.com/in/vladimir-danila-874156140/,2,,
Thomas Schmidt,https://www.crunchbase.com/person/thomas-schmidt-b62c,Individual/Angel,2,,"Leipzig, Sachsen, Germany",,"Thomas Schmidt is a serial entrepreneur, experienced executive and visionary leader in one. As CEO and co- founder of datafactory AG, he has...","European Union (EU), Europe, Middle East, and Africa (EMEA)",,,https://www.be-exponential.com/thomas,https://www.linkedin.com/in/thomas--schmidt,2,,
Stephan Jacquemot,https://www.crunchbase.com/person/stephan-jacquemot,"Individual/Angel, Investment Partner",2,,"Köln, Nordrhein-Westfalen, Germany","Convertible Note, Early Stage Venture, Late Stage Venture, Seed, Venture","TS Ventures is the private investment vehicle of serial entrepreneur Tim Schumacher (e.g. Sedo, Eyeo/AdBlock Plus, Ecosia, etc.) and Stephan...","European Union (EU), Europe, Middle East, and Africa (EMEA)",,,https://www.tsventures.io/,https://www.linkedin.com/in/stephanjacquemot/,2,,
Alexander Argyros,https://www.crunchbase.com/person/alexander-argyros,Individual/Angel,2,,"Berlin, Berlin, Germany",,Alexander Argyros is a co-founder of Moonfare and currently serves in Moonfare's advisory board. He is also a co-founder of 7 Global Capital...,"European Union (EU), Europe, Middle East, and Africa (EMEA)",,,,https://www.linkedin.com/in/alexander-argyros-92a514b,2,,
Philipp Pausder,https://www.crunchbase.com/person/philipp-a--pausder,Individual/Angel,2,,"Berlin, Berlin, Germany",,"Philipp Pausder is the Co-Founder and MD of Thermondo. Prior to Thermondo, Philipp founded Clean Venture, a boutique M&A advisory firm for d...","European Union (EU), Europe, Middle East, and Africa (EMEA)",,,,https://www.linkedin.com/in/philipppausder,2,,
Marvin Homburg,https://www.crunchbase.com/person/marvin-homburg,Individual/Angel,2,,"Germany, Europe",,Marvin Homburg is a Co-Founder and CEO at Evermood. Marvin previously worked at Founders Foundation gGmbH as a Grantee of the Accelerator Pr...,"European Union (EU), Europe, Middle East, and Africa (EMEA)",,,,https://www.linkedin.com/in/marvinhomburg,2,,
Christian Portz,https://www.crunchbase.com/person/christian-portz-3382,Individual/Angel,2,,"Frankfurt, Hessen, Germany",,Christian Portz,"European Union (EU), Europe, Middle East, and Africa (EMEA)",,,,https://www.linkedin.com/in/christian-portz-4b141813a/,2,,
Gero Decker,https://www.crunchbase.com/person/gero-decker,Individual/Angel,2,,"Berlin, Berlin, Germany",Seed,"Gero is a co-founder and CEO, Gero is responsible for Signavio’s overall strategic direction. He is a business process management expert and...","European Union (EU), Europe, Middle East, and Africa (EMEA)",,,,https://www.linkedin.com/in/gerodecker,2,,
Jan Klatten,https://www.crunchbase.com/person/jan-klatten,Individual/Angel,2,,"Munich, Bayern, Germany",,Jan Klatten,"European Union (EU), Europe, Middle East, and Africa (EMEA)",,,,,1,,
Matthias Möller,https://www.crunchbase.com/person/matthias-mller-2,Individual/Angel,2,1,"Munich, Bayern, Germany",Seed,"Matthias is entrepreneur and angel investor based in Munich. His current venture is gogol medien, a pioneer in cloud-based publishing. Hi se...","European Union (EU), Europe, Middle East, and Africa (EMEA)",,,http://www.gogol-medien.de,https://www.linkedin.com/in/matthiasmoeller,2,,
Gregor Bieler,https://www.crunchbase.com/person/gregor-bieler,Individual/Angel,2,,"München, Bayern, Germany","Late Stage Venture, Private Equity, Seed","Experienced international executive with MBA (IMD Lausanne) and profound Digital Technology background. Deep expertise in Software, FinTech ...","European Union (EU), Europe, Middle East, and Africa (EMEA)",,,,https://www.linkedin.com/in/gregorbieler,2,,
Torge Thönnessen,https://www.crunchbase.com/person/torge-thnnessen,Individual/Angel,2,,"Itzehoe, Schleswig-Holstein, Germany",,Torge Thönnessen is the Co-founder and CEO at Custom Cells.,"European Union (EU), Europe, Middle East, and Africa (EMEA)",,,,https://www.linkedin.com/in/torge-thönnessen-030b14128,1,,
Sebastian Moser,https://www.crunchbase.com/person/sebastian-moser-2,Individual/Angel,2,1,"Bayern, Germany, Europe",Seed,Sebastian Moser is a Co-Founder and Managing Director at Everomes and Sublime Stages and Managing Partner at Prime Properties Group. He was ...,"European Union (EU), Europe, Middle East, and Africa (EMEA)",,,,https://www.linkedin.com/in/sebmoser,2,,
Felix Heberle,https://www.crunchbase.com/person/felix-heberle,Individual/Angel,2,1,"Berlin, Berlin, Germany",Seed,"Felix is an entrepreneur and networker at heart. Since founding his first two start-ups while studying at university, Felix has worked at le...","European Union (EU), Europe, Middle East, and Africa (EMEA)",,,,https://www.linkedin.com/in/felixheberle,2,,
Bjorn Jopen,https://www.crunchbase.com/person/bjorn-jopen,Individual/Angel,2,1,"Gräfelfing, Bayern, Germany",,"In 2000, Björn started FairControl GmbH, a consulting company in the field of trade fair and event success control, and sold FairControl in ...","European Union (EU), Europe, Middle East, and Africa (EMEA)",,,,https://www.linkedin.com/in/bjoernjopen/,2,,
Silvia Erika Sommer,https://www.crunchbase.com/person/silvia-erika-sommer,Individual/Angel,2,,"Germany, Europe",,Silvia Erika Sommer is the Co-Founder and Managing Partner of opexxia. Silvia Erika Sommer attended London School of Economics and Political...,"European Union (EU), Europe, Middle East, and Africa (EMEA)",,,,https://www.linkedin.com/in/silvia-erika-sommer/,2,,
Remy Lazarovici,https://www.crunchbase.com/person/remy-lazarovici,Individual/Angel,2,,"Munich, Bayern, Germany",,Remy Lazarovici,"European Union (EU), Europe, Middle East, and Africa (EMEA)",,,,https://www.linkedin.com/in/remy-a-lazarovici/,2,,
Carl-Peter Forster,https://www.crunchbase.com/person/carl-peter-forster,Individual/Angel,2,,"Munich, Bayern, Germany",,"Carl-Peter Edmund Moriz Forster[1] (born 9 May 1954, in London), is a British businessman. Forster was the group Chief Executive of Tata Mot...","European Union (EU), Europe, Middle East, and Africa (EMEA)",,,,,2,,
Stefan Menden,https://www.crunchbase.com/person/stefan-menden,Individual/Angel,2,,"Berlin, Berlin, Germany",,Entrepreneur & Investor with focus on HR-Tech MD (Interim) Xing (2022) Investor in Start-Ups and Turnaround Cases - Eurocentres (sold to Bay...,"European Union (EU), Europe, Middle East, and Africa (EMEA)",,,http://www.mendenventures.com,https://de.linkedin.com/in/stefanmenden,2,,
Fabian Strüngmann,https://www.crunchbase.com/person/fabian-strüngmann,Individual/Angel,2,,"Munich, Bayern, Germany",,Fabian Strüngmann,"European Union (EU), Europe, Middle East, and Africa (EMEA)",,,,https://www.linkedin.com/in/fabian-str%C3%BCngmann-a7b24647/,1,,
Oliver Mickler,https://www.crunchbase.com/person/oliver-mickler,Individual/Angel,2,,"Berlin, Berlin, Germany",,Oliver Mickler - Co-Founder and MD @ Tillhub,"European Union (EU), Europe, Middle East, and Africa (EMEA)",,,,https://www.linkedin.com/in/olivermickler/,2,,
Johannes Schickling,https://www.crunchbase.com/person/johannes-schickling,Individual/Angel,2,,"Berlin, Berlin, Germany",,Johannes Schickling is a Board Member at Prisma. He attended Karlsruhe Institute of Technology (KIT).,"European Union (EU), Europe, Middle East, and Africa (EMEA)",,,https://www.schickling.dev,https://www.linkedin.com/in/schickling,2,,
Stefanie Giesinger,https://www.crunchbase.com/person/stefanie-giesinger,Individual/Angel,2,,"Germany, Europe",,Stefanie Giesinger is a German model.,"European Union (EU), Europe, Middle East, and Africa (EMEA)",,,,,2,1,
Sebastian Mertens,https://www.crunchbase.com/person/sebastian-mertens-8c9a,Individual/Angel,2,,"Gießen, Hessen, Germany",,"Sebastian Mertens is the Managing director, Founder, and Chairman of wemakefuture. He previously worked at ASERVMENT as a CEO and Co-Founder...","European Union (EU), Europe, Middle East, and Africa (EMEA)",,,,https://www.linkedin.com/in/auto-mate,2,,
Falk F. Strascheg,https://www.crunchbase.com/person/falk-f-strascheg,Individual/Angel,2,,"Munich, Bayern, Germany",,Falk F. Strascheg is a Member of Advisory Board of eCAPITAL entrepreneurial Partners AG. He is Founding Partner Extorel GmbH in 1997 and als...,"European Union (EU), Europe, Middle East, and Africa (EMEA)",,,,,2,1,
Holger Felgner,https://www.crunchbase.com/person/holger-felgner,Individual/Angel,2,,"Karlsruhe, Baden-Wurttemberg, Germany",,Holger has set his sights on scaling Chrono24 for an international market. His vast experience with growing companies is the perfect foundat...,"European Union (EU), Europe, Middle East, and Africa (EMEA)",,,,https://www.linkedin.com/in/holgerfelgner,2,,
Claus Sendlinger,https://www.crunchbase.com/person/claus-sendlinger,Individual/Angel,2,,"Berlin, Berlin, Germany",Seed,Sendlinger began his career in the travel industry in 1987 with the founding of an agency specializing in sport and music events. Only four ...,"European Union (EU), Europe, Middle East, and Africa (EMEA)",,,,,1,,
Philipp Hammerich,https://www.crunchbase.com/person/philipp-hammerich,Individual/Angel,2,,"Hamburg, Hamburg, Germany",,Philipp Hammerich,"European Union (EU), Europe, Middle East, and Africa (EMEA)",,,,https://www.linkedin.com/in/dr-philipp-hammerich-2158a5a9/,1,,
Stephan Kniewasser,https://www.crunchbase.com/person/stephan-kniewasser,Individual/Angel,2,,"Munich, Bayern, Germany",,"Stephan is the type of person who relishes new challenges. In 2017, he was named Chief Financial Officer of the Transporeon Group. He brings...","European Union (EU), Europe, Middle East, and Africa (EMEA)",,,,https://www.linkedin.com/in/stephan-kniewasser-2a858812b/,2,,
Marcus Ruebsam,https://www.crunchbase.com/person/marcus-ruebsam,Individual/Angel,2,,"Mannheim, Baden-Wurttemberg, Germany",,Marcus Ruebsam is the Founder and CEO of CibusCell. He previously worked at Signavio as an Executive Advisor. Marcus Ruebsam attended Kingst...,"European Union (EU), Europe, Middle East, and Africa (EMEA)",,,,https://www.linkedin.com/in/marcusruebsam,2,,
Gregoire le Jeune,https://www.crunchbase.com/person/gregoire-le-jeune,Individual/Angel,2,,"Berlin, Berlin, Germany",Early Stage Venture,Gregoire le Jeune is the Interim COO at JellyFi.,"European Union (EU), Europe, Middle East, and Africa (EMEA)",,,https://www.0x5643.xyz/,https://www.linkedin.com/in/gregoireljda,2,,
Benedikt Sauter,https://www.crunchbase.com/person/benedikt-sauter-b740,Individual/Angel,2,,"Augsburg, Bayern, Germany",,Benedikt Sauter,"European Union (EU), Europe, Middle East, and Africa (EMEA)",,,,,2,,
Christoph Miller,https://www.crunchbase.com/person/christoph-miller,"Individual/Angel, Investment Partner",2,,"Hamburg, Germany, Europe",,Christoph Miller - Founding Partner @ Oyster Bay Venture Capital,"European Union (EU), Europe, Middle East, and Africa (EMEA)",,,,https://www.linkedin.com/in/christoph-miller-91a85b13/,2,,
Josef Ackermann,https://www.crunchbase.com/person/josef-ackermann,Individual/Angel,2,,"Frankfurt, Hessen, Germany",Seed,"Born February 7, 1948. A Swiss national, appointed a Non-executive Director of the Company in May 2008.He started his professional career in...","European Union (EU), Europe, Middle East, and Africa (EMEA)",,,,https://www.linkedin.com/pub/josef-ackermann/7/6/9,2,,
Andre Christ,https://www.crunchbase.com/person/andré-christ,Individual/Angel,2,,"Cologne, Nordrhein-Westfalen, Germany",,Andre Christ - CEO @ LeanIX,"European Union (EU), Europe, Middle East, and Africa (EMEA)",,,,https://www.linkedin.com/in/andrechrist,2,,
Patrice Deckert,https://www.crunchbase.com/person/patrice-deckert,Individual/Angel,2,,"Berlin, Berlin, Germany",Seed,Patrice Deckert - Venture Partner @ Heilemann Ventures,"European Union (EU), Europe, Middle East, and Africa (EMEA)",,,,https://www.linkedin.com/in/patricedeckert,2,,
Niklas Hellemann,https://www.crunchbase.com/person/niklas-hellemann,Individual/Angel,2,,"Köln, Nordrhein-Westfalen, Germany",,"Dr. Niklas Hellemann is a certified psychologist, long-term management consultant and Managing Director at SoSafe Cyber ​​Security Awareness...","European Union (EU), Europe, Middle East, and Africa (EMEA)",,,,https://www.linkedin.com/in/nhellemann/,2,,
Constantin Robertz,https://www.crunchbase.com/person/constantin-robertz,Individual/Angel,2,,"Berlin, Germany, Europe",,Constantin is managing director for Zalora in the Philippines. He has been in the Philippines since 2013 and previously worked with Rocket I...,"European Union (EU), Europe, Middle East, and Africa (EMEA)",,,,https://www.linkedin.com/in/constantin-robertz-299a288/,2,,
Oliver Heine,https://www.crunchbase.com/person/oliver-heine,Individual/Angel,2,,"Hamburg, Hamburg, Germany",,"Oliver Heine is an Attorney at Law and Partner of the law firm Heine & Partner since 1995. Previously, from 1993 to 1995 Heine was Working a...","European Union (EU), Europe, Middle East, and Africa (EMEA)",,,,,2,,
Maximilian Hasler,https://www.crunchbase.com/person/maximilian-hasler,Individual/Angel,2,,"Munich, Bayern, Germany","Early Stage Venture, Seed",Maximilian Hasler - COO & Co-Founder @ KONUX,"European Union (EU), Europe, Middle East, and Africa (EMEA)",,,,https://www.linkedin.com/in/maxhasler/,2,,
Christian Grobe,https://www.crunchbase.com/person/axel-jünke,Individual/Angel,2,,"Berlin, Berlin, Germany",,"Christian Grobe is a Berlin-based serial entrepreneur and has just founded his second fintech venture, Billie. From 2008 to 2014, Matthias w...","European Union (EU), Europe, Middle East, and Africa (EMEA)",,,,https://www.linkedin.com/in/christian-grobe-91b72584,2,,
‪Daniel Kondermann‬,https://www.crunchbase.com/person/daniel-kondermann,Individual/Angel,2,,"Heidelberg, Baden-Wurttemberg, Germany",,Daniel Kondermann is the CEO and Founder at Quality Match.,"European Union (EU), Europe, Middle East, and Africa (EMEA)",,,,https://www.linkedin.com/in/daniel-kondermann-08109117,2,,
Wieland Sommer,https://www.crunchbase.com/person/wieland-sommer,Individual/Angel,2,,"Munich, Bayern, Germany",,"Founder and CEO of Smart Reporting; Professor of Radiology; Master in Public Health (Harvard, Boston, USA)","European Union (EU), Europe, Middle East, and Africa (EMEA)",,,,https://www.linkedin.com/in/wieland-sommer-95079876,2,,
Juergen Ringbeck,https://www.crunchbase.com/person/juergen-ringbeck,Individual/Angel,2,,"Düsseldorf, Nordrhein-Westfalen, Germany",,Honorary Professor Dr. Jürgen Ringbeck has been teaching at WHU as an honorary professor since 2014. He has been associated with WHU as a gu...,"European Union (EU), Europe, Middle East, and Africa (EMEA)",,,,https://www.linkedin.com/in/j%C3%BCrgen-ringbeck-73b8889,2,,
Ortwin Kartmann,https://www.crunchbase.com/person/ortwin-kartmann,Individual/Angel,2,,"Frankfurt, Hessen, Germany",Seed,"Founder of Sofortüberweisung, Shopgate, Otark","European Union (EU), Europe, Middle East, and Africa (EMEA)",,,https://ok.vc,https://www.linkedin.com/in/kartmann,2,,
Daniel Schellhoss,https://www.crunchbase.com/person/daniel-schellhoss,Individual/Angel,2,,"Cologne, Nordrhein-Westfalen, Germany",,Daniel Schellhoss,"European Union (EU), Europe, Middle East, and Africa (EMEA)",,,,https://www.linkedin.com/in/danielschellhoss/,2,,
Peter Dietrich,https://www.crunchbase.com/person/peter-dietrich,Individual/Angel,2,,"Berlin, Berlin, Germany",Seed,The lawyer Peter Dietrich worked as a headhunter at Kienbaum and Heidrick & Struggles before he became Sales Director for Enterprise Finance...,"European Union (EU), Europe, Middle East, and Africa (EMEA)",,,,https://www.linkedin.com/in/peterdietrich,1,,
Marc Griefahn,https://www.crunchbase.com/person/marc-griefahn,Individual/Angel,2,,"Hamburg, Hamburg, Germany",Seed,"Marc Griefahn is Chairman of Weinmann Emergency, the leading respiratory resuscitation company, with headquarters in Hamburg, Germany. Marc ...","European Union (EU), Europe, Middle East, and Africa (EMEA)",,,,http://www.linkedin.com/pub/marc-griefahn/5/b06/a87,2,,
Katrin Stark,https://www.crunchbase.com/person/katrin-stark,Individual/Angel,2,,"Frankfurt, Hessen, Germany",,Katrin Stark,"European Union (EU), Europe, Middle East, and Africa (EMEA)",,,,https://www.linkedin.com/in/dr-katrin-stark-093959bb/?locale=en_US&trk=public_post_main-feed-card_reshare-text,1,,
Sebastian Heide-Meyer zu Erpen,https://www.crunchbase.com/person/sebastian-heide-meyer-zu-erpen,Individual/Angel,2,,"Berlin, Berlin, Germany",,Sebastian Heide-Meyer zu Erpen,"European Union (EU), Europe, Middle East, and Africa (EMEA)",,,,https://www.linkedin.com/in/sebastian-heide-meyer-zu-erpen-bab7aa74/?originalSubdomain=de,2,,
Christopher Huesmann,https://www.crunchbase.com/person/christopher-huesmann,Individual/Angel,2,,"Münster, Nordrhein-Westfalen, Germany",,Christopher Huesmann,"European Union (EU), Europe, Middle East, and Africa (EMEA)",,,,https://www.linkedin.com/in/christopher-huesmann-4913746a,2,,
Henrik Schunk,https://www.crunchbase.com/person/henrik-schunk,Individual/Angel,2,,"Lauffen Am Neckar, Baden-Wurttemberg, Germany",,"Henrik Schunk, the CEO of SCHUNK GmbH & Co.","European Union (EU), Europe, Middle East, and Africa (EMEA)",,,,https://www.linkedin.com/in/henrik-schunk-3a0a9098/,2,,
Bernd Geilen,https://www.crunchbase.com/person/bernd-geilen,Individual/Angel,2,1,"Frankfurt, Hessen, Germany",,Bernd Geilen used to work as CEO for ING Germany.,"European Union (EU), Europe, Middle East, and Africa (EMEA)",,,,https://www.linkedin.com/in/bernd-geilen-a069a635/?originalSubdomain=de,2,,
Albrecht von Sonntag,https://www.crunchbase.com/person/albrecht-von-sonntag,Individual/Angel,2,,"Belin, Brandenburg, Germany",Seed,Albrecht von Sonntag - Managing Director @ idealo,"European Union (EU), Europe, Middle East, and Africa (EMEA)",,,,https://www.linkedin.com/in/albrecht-von-sonntag-1b99014,1,,
Philip Ginthoer,https://www.crunchbase.com/person/philip-ginthoer,Individual/Angel,2,,"München, Bayern, Germany",,Philip Ginthoer,"European Union (EU), Europe, Middle East, and Africa (EMEA)",,,,https://www.linkedin.com/in/philip-e-ginthoer-33170b8b,2,,
Dr. Cedric Duvinage,https://www.crunchbase.com/person/dr-cedric-duvinage,"Individual/Angel, Investment Partner",2,,"Munich, Bayern, Germany",,Dr. Cedric Duvinage is the Founder @ better ventures. He attended WHU – Otto Beisheim School of Management.,"European Union (EU), Europe, Middle East, and Africa (EMEA)",,,https://www.betterventures.io,https://www.linkedin.com/in/cedricduvinage/,2,,
Frank Carsten Herzog,https://www.crunchbase.com/person/frank-carsten-herzog,"Individual/Angel, Investment Partner",2,,"Lichtenfels, Bayern, Germany",,Frank Carsten Herzog,"European Union (EU), Europe, Middle East, and Africa (EMEA)",,,,https://www.linkedin.com/in/frank-carsten-herzog-607874226/?originalSubdomain=de,2,,
Carsten Lebtig,https://www.crunchbase.com/person/carsten-lebtig,Individual/Angel,2,,"Berlin, Berlin, Germany",,Carsten Lebtig - Founder @ WorkMotion,"European Union (EU), Europe, Middle East, and Africa (EMEA)",,,,https://www.linkedin.com/in/lebtig,2,,
Guido Peters,https://www.crunchbase.com/person/guido-peters,Individual/Angel,2,,"Germany, Europe",Seed,Guido Peters - International Business Development Manager @ Continental,"European Union (EU), Europe, Middle East, and Africa (EMEA)",,,,https://www.linkedin.com/in/gupeters,2,,
