Tijen Onaran,https://www.crunchbase.com/person/tijen-onaran,Individual/Angel,7,1,"Berlin, Berlin, Germany",,Tijen Onaran - CEO & Founder @ Global Digital Women,"European Union (EU), Europe, Middle East, and Africa (EMEA)",,,http://tijen-onaran.de,https://www.linkedin.com/in/tijen-onaran-210ba0104?authType=NAME_SEARCH&authToken=YDho&locale=en_US&trk=tyah&trkInfo=clickedVertical%3Amynetwork%2CclickedEntityId%3A444870444%2CauthType%3ANAME_SEARCH%2Cidx%3A1-1-1%2CtarId%3A1460986751059%2Ctas%3Atijen,6,2,
Roland Berger,https://www.crunchbase.com/person/roland-berger,Individual/Angel,7,,"Munich, Bayern, Germany",Seed,"Roland Berger is a Founder of Roland Berger, Munich and has been the Roland Berger GmbH's Honorary Chairman since 2010. Today, Roland Berger...","European Union (EU), Europe, Middle East, and Africa (EMEA)",,,,https://www.linkedin.com/in/rob-henske-2179687,6,,
Octave Klaba,https://www.crunchbase.com/person/octave-klaba,"Individual/Angel, Investment Partner",7,,"Hanover, Niedersachsen, Germany",,Octave Klaba is a Chairman of the Board of Directors at OVHcloud.,"European Union (EU), Europe, Middle East, and Africa (EMEA)",,,,https://www.linkedin.com/in/octave-klaba-3a0b3632,7,,
Dirk Freise,https://www.crunchbase.com/person/dirk-freise,"Individual/Angel, Investment Partner",7,1,"Hamburg, Hamburg, Germany",,Dirk Freise - Managing Director @ non olet,"European Union (EU), Europe, Middle East, and Africa (EMEA)",,,,https://de.linkedin.com/in/dirkfreise,6,,
Christopher Isak,https://www.crunchbase.com/person/christopher-isak,Individual/Angel,7,,"Frankfurt, Hessen, Germany",Seed,Christopher Isak - Founder @ TechAcute,"European Union (EU), Europe, Middle East, and Africa (EMEA)",,,,https://de.linkedin.com/in/christopherisak,7,,
Leon Szeli,https://www.crunchbase.com/person/leon-szeli,Individual/Angel,6,,"Munich, Bayern, Germany",,Leon Szeli is the CEO at Presize.,"European Union (EU), Europe, Middle East, and Africa (EMEA)",,,,https://www.linkedin.com/in/leonszeli/,6,,
Oliver Samwer,https://www.crunchbase.com/person/oliver-samwer,"Individual/Angel, Investment Partner",6,,"Munich, Bayern, Germany",Seed,"Oliver Samwer was born in Cologne, Germany, in 1972. Oliver holds M.Sc. degree in Business Administration from WHU – Otto Beisheim School of...","European Union (EU), Europe, Middle East, and Africa (EMEA)",,,https://18salisbury.capital,https://www.linkedin.com/in/oliver-samwer-330559/,4,,
Trent McConaghy,https://www.crunchbase.com/person/trent-mcconaghy,Individual/Angel,6,,"Berlin, Germany, Europe",,"Trent McConaghy is the founder of Ocean Protocol, which is unbounding AI via blockchain technology.  Past:  - co-founded Analog Design Auto...","European Union (EU), Europe, Middle East, and Africa (EMEA)",,,,,6,1,
Tushar Ahluwalia,https://www.crunchbase.com/person/tushar-ahluwalia,Individual/Angel,6,1,"Germany, Europe",,Tushar Ahluwalia is the Co-Founder and CEO at Razor Group.,"European Union (EU), Europe, Middle East, and Africa (EMEA)",,,,https://www.linkedin.com/in/tushar-ahluwalia,5,,
Philipp Zentner,https://www.crunchbase.com/person/philipp-zentner,Individual/Angel,6,,"Berlin, Berlin, Germany",Seed,Founder & CEO of LI.FI,"European Union (EU), Europe, Middle East, and Africa (EMEA)",,,https://philippzentner.com,https://www.linkedin.com/in/philippzentner,6,,
Jutta Steiner,https://www.crunchbase.com/person/jutta-steiner,Individual/Angel,6,,"Berlin, Berlin, Germany",,Jutta Steiner is the co-founder and CEO of Parity Technologies.Parity Technologies has developed the most advanced Ethereum client and has r...,"European Union (EU), Europe, Middle East, and Africa (EMEA)",,,,https://de.linkedin.com/in/jutta-steiner-07bb0695,6,,
Joachim Drees,https://www.crunchbase.com/person/joachim-drees,Individual/Angel,6,,"Germany, Europe",,"Joachim Drees was born on November 20, 1964 in Düsseldorf. He studied business administration at the University of Stuttgart and did his MB...","European Union (EU), Europe, Middle East, and Africa (EMEA)",,,,https://www.linkedin.com/in/joachim-drees-23a2762,5,,
Carlo Kölzer,https://www.crunchbase.com/person/carlo-koelzer,Individual/Angel,6,3,"Berlin, Berlin, Germany",Seed,Carlo Koelzer is a founding partner and member of 360T’s Group Executive Board and Deutsche Börse Group Management Committee member. Further...,"European Union (EU), Europe, Middle East, and Africa (EMEA)",,,,,6,,
Hakan Koc,https://www.crunchbase.com/person/hakan-koç,Individual/Angel,6,2,"Berlin, Berlin, Germany",Seed,Hakan Koc is the founder and managing director of  AUTO1 Group. He was previously the chief product officer at Home24.de. Koc holds an LLB ...,"European Union (EU), Europe, Middle East, and Africa (EMEA)",,,,https://www.linkedin.com/in/hakan-koc,6,,
Adrian Locher,https://www.crunchbase.com/person/adrian-locher,"Individual/Angel, Investment Partner",6,3,"Berlin, Berlin, Germany",,"Adrian Locher is the Founder, CEO and General Partner of Merantix. He Kausa as a Board Member.Adrian Locher attended the University of St.Ga...","European Union (EU), Europe, Middle East, and Africa (EMEA)",,,http://adrianlocher.com,https://www.linkedin.com/in/adrianlocher,5,,
Sercan Alici,https://www.crunchbase.com/person/sercan-alici,"Individual/Angel, Investment Partner",6,1,"Hamburg, Germany, Europe",,Sercan Alici,"European Union (EU), Europe, Middle East, and Africa (EMEA)",,,,https://www.linkedin.com/in/sercanalc/,5,,
Michael Stephan,https://www.crunchbase.com/person/michael-stephan,Individual/Angel,6,,"Berlin, Berlin, Germany",,Michael Stephan is the Co-Founder and Chief Operating Officer of Raisin DS.,"European Union (EU), Europe, Middle East, and Africa (EMEA)",,,,https://www.linkedin.com/in/michaeltobiasstephan/,4,,
Sebastian Johnston,https://www.crunchbase.com/person/sebastian-johnston,Individual/Angel,6,1,"Hamburg, Hamburg, Germany",Seed,Sebastian Johnston is a Venture Partner at Armira. He previously worked at Vivere and attended Instituto Tecnológico Autónomo de México.,"European Union (EU), Europe, Middle East, and Africa (EMEA)",,,,https://www.linkedin.com/in/sebastianjohnston,6,,
Philipp Westermeyer,https://www.crunchbase.com/person/philipp-westermeyer,"Individual/Angel, Investment Partner",6,,"Hamburg, Hamburg, Germany",,"Philipp Westermeyer is the founder of the Online Marketing Rockstars. Prior to that, Philipp founded Metrigo GmbH and adyard GmbH. He also s...","European Union (EU), Europe, Middle East, and Africa (EMEA)",,,,https://www.linkedin.com/in/philipp-westermeyer-3966813a,6,,
Stefan Peukert,https://www.crunchbase.com/person/stefan-peukert,Individual/Angel,6,1,"Bochum, Nordrhein-Westfalen, Germany",Seed,"Founder of Masterplan.com Founder of Employour Group (Ausbildung.de, meinpraktikum.de, trainee.de) - sold to Bertelsmann 2015","European Union (EU), Europe, Middle East, and Africa (EMEA)",,,,https://www.linkedin.com/in/peukert/,5,,
Andreas Wiele,https://www.crunchbase.com/person/dr-andreas-wiele,"Individual/Angel, Investment Partner",6,,"Berlin, Berlin, Germany",,"Andreas Wiele is the President of Marketing and Classified Ad Models at Axel Springer SE since April 2014. Andreas was in born 1962, he stud...","European Union (EU), Europe, Middle East, and Africa (EMEA)",,,,http://de.linkedin.com/pub/andreas-wiele/2/a07/717,6,,
Diana zur Löwen,https://www.crunchbase.com/person/diana-zur-löwen,Individual/Angel,6,,"Berlin, Berlin, Germany",,Diana zur Löwen,"European Union (EU), Europe, Middle East, and Africa (EMEA)",,,,https://www.linkedin.com/in/dianazurloewen,5,,
Max Tayenthal,https://www.crunchbase.com/person/max-tayenthal,Individual/Angel,6,,"Berlin, Berlin, Germany",,Maximilian Tayenthal is Founder & Co-CEO at N26.,"European Union (EU), Europe, Middle East, and Africa (EMEA)",,,,https://www.linkedin.com/in/maximilian-tayenthal/?originalSubdomain=de,6,,
Ignaz Forstmeier,https://www.crunchbase.com/person/ignaz-forstmeier,Individual/Angel,6,,"Munich, Bayern, Germany",,Ignaz Forstmeier - Co-Founder @ Personio,"European Union (EU), Europe, Middle East, and Africa (EMEA)",,,,https://www.linkedin.com/in/ignazforstmeier/,5,,
Ingo Weber,https://www.crunchbase.com/person/ingo-weber-e58e,Individual/Angel,6,,"Stuttgart, Baden-Wurttemberg, Germany",,Ingo Weber - Founder and CEO @ Carcharodon Capital,"European Union (EU), Europe, Middle East, and Africa (EMEA)",,,,https://www.linkedin.com/in/iweber/,6,,
Kelly Ford,https://www.crunchbase.com/person/kelly-ford,Individual/Angel,6,2,"Berlin, Berlin, Germany","Convertible Note, Early Stage Venture, Seed",Kelly Ford,"European Union (EU), Europe, Middle East, and Africa (EMEA)",,,http://www.kellynford.com,https://www.linkedin.com/in/kellynford/,6,,
Patrick Poschl,https://www.crunchbase.com/person/patrick-pöschl,Individual/Angel,6,,"Munich, Bayern, Germany",,Patrick spent over 8 years in the financial service industry based in Vienna and London. Most recently before Scalable at Goldman Sachs in L...,"European Union (EU), Europe, Middle East, and Africa (EMEA)",,,,https://www.linkedin.com/in/patrickpoeschl/,3,1,
Marcus Wolsdorf,https://www.crunchbase.com/person/marcus-wolsdorf,"Individual/Angel, Investment Partner",6,1,"Germany, Europe",Seed,Marcus Wolsdorf is the Co-Founder & Co-Owner of HW Capital. He previously worked at Interhyp Gruppe as a Co-Founder & Co-CEO. Marcus Wolsdor...,"European Union (EU), Europe, Middle East, and Africa (EMEA)",,,,https://www.linkedin.com/in/marcus-wolsdorf-b62a0740,6,,
Stefan Gross-Selbeck,https://www.crunchbase.com/person/stefan-gro-selbeck,Individual/Angel,6,,"Potsdam, Brandenburg, Germany",Seed,"As one of Germany’s most accomplished executives in the digital space, Stefan Groß-Selbeck has been successfully building, launching and run...","European Union (EU), Europe, Middle East, and Africa (EMEA)",,,,https://www.linkedin.com/in/stefan-gross-selbeck-424066b/,6,,
Lars Hinrichs,https://www.crunchbase.com/person/lars-hinrichs,"Individual/Angel, Investment Partner",6,4,"Hamburg, Hamburg, Germany","Early Stage Venture, Private Equity, Seed, Venture",Lars Hinrichs first logged onto the internet in 1989 with an acoustic coupler and hasn't logged off since. This early passion for all things...,"European Union (EU), Europe, Middle East, and Africa (EMEA)",,,,http://de.linkedin.com/in/larshinrichs,6,1,
Martin Ostermayer,https://www.crunchbase.com/person/martin-ostermayer,"Individual/Angel, Investment Partner",6,1,"Hamburg, Germany, Europe",,"CEO of Shortcut Ventures GmbH in Hamburg, Germany. Martin Ostermayer is one of the CEOs of the venture capital firm, Shortcut Ventures, l...","European Union (EU), Europe, Middle East, and Africa (EMEA)",,,,https://de.linkedin.com/in/martin-ostermayer-1142a6,5,,
Roland Grenke,https://www.crunchbase.com/person/roland-grenke,Individual/Angel,6,4,"Berlin, Berlin, Germany",,Roland Grenke - Co-Founder @ Acapela,"European Union (EU), Europe, Middle East, and Africa (EMEA)",,,,https://www.linkedin.com/in/roland-grenke-42133180,6,,
André M. Bajorat,https://www.crunchbase.com/person/andré-m-bajorat,Individual/Angel,6,2,"Hamburg, Hamburg, Germany",Seed,Andre Bajorat is the Head of Strategy Corporate Bank at Deutsche Bank. He attended the University of Cologne from 1994 to 1997.,"European Union (EU), Europe, Middle East, and Africa (EMEA)",,,https://www.Paymentandbanking.com,https://www.linkedin.com/in/abajorat,6,,
Christian Hülsewig,https://www.crunchbase.com/person/christian-hülsewig,Individual/Angel,6,,"Gütersloh, Nordrhein-Westfalen, Germany",,Christian Hülsewig is a Founder and CEO at Schüttflix. He attended  Bentley University 2004 - 2008.,"European Union (EU), Europe, Middle East, and Africa (EMEA)",,,,https://www.linkedin.com/in/christianhuelsewig/,5,,
Gerald Schoenbucher,https://www.crunchbase.com/person/dr-gerald-schnbucher,Individual/Angel,6,2,"Cologne, Nordrhein-Westfalen, Germany",Seed,Gerald Schoenbucher is a CEO at Real.digital. He attended  WHU – Otto Beisheim School of Management from 2004 to 2007.,"European Union (EU), Europe, Middle East, and Africa (EMEA)",,,http://www.real.de,,6,,
Heissam Hartmann,https://www.crunchbase.com/person/heissam-hartmann,Individual/Angel,6,2,"Berlin, Berlin, Germany",Seed,Over 15 years experience in the Internet industry back Heissam Hartmann's solid knowledge about the online business. Prior to joining Reb...,"European Union (EU), Europe, Middle East, and Africa (EMEA)",,,http://www.passiontainment.com,http://www.linkedin.com/in/heissam,6,,
Patric Fassbender,https://www.crunchbase.com/person/patric-fassbender,Individual/Angel,6,,"Cologne, Nordrhein-Westfalen, Germany",,Patric Fassbender is the Co-Founder and Managing Partner at Boxine.,"European Union (EU), Europe, Middle East, and Africa (EMEA)",,,,https://www.linkedin.com/in/patric-fassbender-7656438,6,,
Oliver Thylmann,https://www.crunchbase.com/person/oliver-thylmann,Individual/Angel,6,3,"Cologne, Nordrhein-Westfalen, Germany",Seed,"Oliver Thylmann is an investor and entrepreneur based in Cologne, Germany. Thylmann is the co-founder and chief customer officer at Giant Sw...","European Union (EU), Europe, Middle East, and Africa (EMEA)",,,,http://www.linkedin.com/in/thylmann,6,,1
Andy Bruckschloegl,https://www.crunchbase.com/person/andreas-bruckschlogl,Individual/Angel,6,2,"Munich, Bayern, Germany","Crowdfunding, Seed","Andreas Bruckschlögl started his first business at the age of 12, selling backpacks on eBay. A year later he founded his first online shop. ...","European Union (EU), Europe, Middle East, and Africa (EMEA)",,,http://andy.co,https://www.linkedin.com/in/bruckschloegl,5,,
Georg Kofler,https://www.crunchbase.com/person/georg-kofler,Individual/Angel,6,,"Berlin, Berlin, Germany",,Georg Kofler is an angel investor.,"European Union (EU), Europe, Middle East, and Africa (EMEA)",,,,https://www.linkedin.com/in/drgeorgkofler,6,,
Lothar Stein,https://www.crunchbase.com/person/lothar-stein,Individual/Angel,6,1,"Munich, Bayern, Germany",Seed,Lothar Stein - Mentor @ SINN Power,"European Union (EU), Europe, Middle East, and Africa (EMEA)",,,,https://www.linkedin.com/in/lothar-stein-3ba52856,2,,
Jan Beckers,https://www.crunchbase.com/person/jan-beckers,Individual/Angel,5,,"Berlin, Berlin, Germany",,Jan Beckers is the Founder and Chief Investment Officer at BIT Capital. He studied at Münster University of Münster,"European Union (EU), Europe, Middle East, and Africa (EMEA)",,,,https://www.linkedin.com/in/janbeckers,5,,
Martina Pfeifer,https://www.crunchbase.com/person/martina-pfeifer,Individual/Angel,5,,"Frankfurt, Hessen, Germany",,Martina Pfeifer joined Advent International GmbH in 2009 and acts as an advisor in the German-speaking region. Previously she worked for Gol...,"European Union (EU), Europe, Middle East, and Africa (EMEA)",,,,https://www.linkedin.com/in/martina-pfeifer-b2aa8675,5,,
Jens Lapinski,https://www.crunchbase.com/person/jens-lapinski,"Individual/Angel, Investment Partner",5,,"Berlin, Berlin, Germany",,"Jens is the CEO of Angel Invest Ventures. He is one of Europe's most active angel investors, making 10 - 20 investments per year. Jens lives...","European Union (EU), Europe, Middle East, and Africa (EMEA)",,,http://jenslapinski.com,http://www.linkedin.com/in/jenslapinski,5,,
Christoph Baumeister,https://www.crunchbase.com/person/christoph-baumeister,"Individual/Angel, Investment Partner",5,1,"Munich, Bayern, Germany","Early Stage Venture, Seed","Christoph is an early-stage deeptech investor with strong entrepreneurial roots, having transitioned to the investor side after co-founding ...","European Union (EU), Europe, Middle East, and Africa (EMEA)",,,,https://www.linkedin.com/in/christophbaumeister/,5,,
Philipp Andernach,https://www.crunchbase.com/person/philipp-andernach,Individual/Angel,5,,"Berlin, Berlin, Germany",,Philipp Andernach,"European Union (EU), Europe, Middle East, and Africa (EMEA)",,,,https://www.linkedin.com/in/philippandernach/,4,,
Daniel Khachab,https://www.crunchbase.com/person/daniel-khachab,Individual/Angel,5,,"Berlin, Berlin, Germany",,Daniel Khachab is a Co-Founder & CEO at Choco. He attended Maastricht University.,"European Union (EU), Europe, Middle East, and Africa (EMEA)",,,,https://www.linkedin.com/in/danielkhachab/,5,,
Viet Le,https://www.crunchbase.com/person/viet-le-83fd,"Individual/Angel, Investment Partner",5,,"Munich, Bayern, Germany",,Viet Le - Partner @ General Catalyst,"European Union (EU), Europe, Middle East, and Africa (EMEA)",,,,https://www.linkedin.com/in/levile,5,,
Christoph Zoeller,https://www.crunchbase.com/person/christoph-zoeller,Individual/Angel,5,,"Heidelberg, Baden-Wurttemberg, Germany",,Christoph Zoeller is a Co-Founder & CEO at Instaffo.,"European Union (EU), Europe, Middle East, and Africa (EMEA)",,,,https://www.linkedin.com/in/christoph-zoeller-b35527118,4,,
Julian Stiefel,https://www.crunchbase.com/person/julian-stiefel,Individual/Angel,5,,"Berlin, Berlin, Germany",,Julian Stiefel is the Founder and Chief Executive Officer at WHU Inside Business.,"European Union (EU), Europe, Middle East, and Africa (EMEA)",,,,https://www.linkedin.com/in/julian-stiefel-b35a26100/,5,,
Christian Rebernik,https://www.crunchbase.com/person/christian-rebernik,Individual/Angel,5,,"Berlin, Berlin, Germany",Early Stage Venture,"Christian is the Co-Founder and CEO of Tomorrow’s Education and was a Founder and CEO of Vivy, a personal health record, and assistant who h...","European Union (EU), Europe, Middle East, and Africa (EMEA)",,,,http://www.linkedin.com/in/crebernik,5,,
Julian Teicke,https://www.crunchbase.com/person/julian-teicke,"Individual/Angel, Investment Partner",5,,"Berlin, Berlin, Germany",Seed,Julian Teicke is the Founder and Partner of The Delta. He previously worked at wefox as a Founder and CEO. Julian Teicke attended the Univer...,"European Union (EU), Europe, Middle East, and Africa (EMEA)",,,,https://www.linkedin.com/in/julianteicke,4,,
Johannes de Waal,https://www.crunchbase.com/person/johannes-de-waal,Individual/Angel,5,,"Berlin, Berlin, Germany",,Johannes de Waal,"European Union (EU), Europe, Middle East, and Africa (EMEA)",,,http://www.aocapital.xyz,,5,,
Sebastian Schuon,https://www.crunchbase.com/person/sebastian-schuon,Individual/Angel,5,1,"Munich, Bayern, Germany",Seed,Sebastian Schuon is the Founder and CEO of Alasco.,"European Union (EU), Europe, Middle East, and Africa (EMEA)",,,,https://www.linkedin.com/in/schuon,5,,
Mischa Rurup,https://www.crunchbase.com/person/mischa-rürup,Individual/Angel,5,1,"Munich, Bayern, Germany",Seed,"Mischa Rurup is an entrepreneur, founder and CEO of Usercentrics, a GDPR solution for enterprise customers and online marketing agencies.","European Union (EU), Europe, Middle East, and Africa (EMEA)",,,,https://www.linkedin.com/in/mischaruerup/,4,,
Kim Nis Neuhauss,https://www.crunchbase.com/person/kim-nis-neuhauss,Individual/Angel,5,,"Germany, Europe","Convertible Note, Early Stage Venture, Seed",Kim Nis Neuhauss is a CEO and Founder at alfatier. Kim previously worked at Bright Skies - a Rackspace Technology Company as a General Manag...,"European Union (EU), Europe, Middle East, and Africa (EMEA)",,,https://xunil.de,https://www.linkedin.com/in/kimneuhauss/,4,1,
Jan Wilmking,https://www.crunchbase.com/person/jan-wilmking,Individual/Angel,5,,"Berlin, Germany, Europe","Early Stage Venture, Seed",I believe in business can be a force of good. That’s why I invest in solutions for our world‘s most pressing issues. Passionate about human ...,"European Union (EU), Europe, Middle East, and Africa (EMEA)",,,,http://www.linkedin.com/pub/jan-wilmking/4/63a/a99,5,,
Nicolas Peters,https://www.crunchbase.com/person/nicolas-peters,"Individual/Angel, Investment Partner",5,,"Berlin, Germany, Europe",,Nicolas is co-CTO and brings several years of industrial experience in software engineering to the company. Before joining Signavio he worke...,"European Union (EU), Europe, Middle East, and Africa (EMEA)",,,,https://www.linkedin.com/in/nicolas-peters-a50866182/,4,,
Thomassin Emmanuel,https://www.crunchbase.com/person/emmanuel-thomassin,Individual/Angel,5,,"Berlin, Berlin, Germany",,Emmanuel Thomassin joined Delivery Hero in January 2014 as Chief Financial Officer. Emmanuel is responsible for the financial activities of ...,"European Union (EU), Europe, Middle East, and Africa (EMEA)",,,,https://www.linkedin.com/in/emmanuel-thomassin-23b5672/,5,1,
Tao Tao,https://www.crunchbase.com/person/tao-tao,Individual/Angel,5,,"Berlin, Berlin, Germany",Seed,Tao Tao is Co-Founder & COO at GetYourGuide.,"European Union (EU), Europe, Middle East, and Africa (EMEA)",,,,https://www.linkedin.com/in/taotaotao,5,,
Christoph Deckert,https://www.crunchbase.com/person/christoph-deckert,Individual/Angel,5,,"Munich, Bayern, Germany",,Christoph Deckert is a Head of Growth of Personio.,"European Union (EU), Europe, Middle East, and Africa (EMEA)",,,,https://www.linkedin.com/in/christophdeckert/,5,,
NiMA Asghari,https://www.crunchbase.com/person/nima-asghari,"Individual/Angel, Investment Partner",5,,"Berlin, Berlin, Germany",,Nima Asghari is the investor at MintKudos.,"European Union (EU), Europe, Middle East, and Africa (EMEA)",,,http://nima.io,http://de.linkedin.com/in/nimaasghari,5,,
Christopher Muenchhoff,https://www.crunchbase.com/person/christopher-muenchhoff,Individual/Angel,5,1,"Berlin, Berlin, Germany",Seed,"Christopher Muenchhoff is an investor and business angel. He co-founded DealPilot.com, one of the first price search engines, in 1997 and...","European Union (EU), Europe, Middle East, and Africa (EMEA)",,,,http://www.linkedin.com/pub/christopher-muenchhoff/0/7/a2,5,,
Marcus Stahl,https://www.crunchbase.com/person/marcus-stahl-c0ba,Individual/Angel,5,,"Cologne, Nordrhein-Westfalen, Germany",,Marcus Stahl is the Co-Founder & Managing Director at Boxine.,"European Union (EU), Europe, Middle East, and Africa (EMEA)",,,,,5,,
Ina Schlie,https://www.crunchbase.com/person/ina-schlie,Individual/Angel,5,,"Walldorf, Baden-Wurttemberg, Germany",,Ina Schlie serves as co-chair of the female investor network encourage ventures.,"European Union (EU), Europe, Middle East, and Africa (EMEA)",,,,https://www.linkedin.com/in/ina-schlie-62729775/,5,,
Roger Crook,https://www.crunchbase.com/person/roger-crook,Individual/Angel,5,1,"Germany, Europe",,Mr. Roger Crook has been Member of the Management Board with responsibility for the Global Forwarding and Freight Division at Deutsche Post ...,"European Union (EU), Europe, Middle East, and Africa (EMEA)",,,,https://www.linkedin.com/in/rogercrook,5,1,
Volker Rofalski,https://www.crunchbase.com/person/volker-rofalski,"Individual/Angel, Investment Partner",5,,"Munich, Bayern, Germany",,"Volker Rofalski is the founder of WebStock AG, which he sold to BAADER Bank in 1999 and TradeCross AG, which he sold to VEM Aktienbank in 20...","European Union (EU), Europe, Middle East, and Africa (EMEA)",,,https://mountain.partners/team/,https://www.linkedin.com/in/volker-rofalski-30a19213/,3,,
Stephan Rohr,https://www.crunchbase.com/person/stephan-rohr,Individual/Angel,5,,"Munich, Bayern, Germany",,Founder & Co-CEO @ TWAICE.,"European Union (EU), Europe, Middle East, and Africa (EMEA)",,,,https://www.linkedin.com/in/dr-stephan-rohr-01a353a7/,3,,
Martin Blessing,https://www.crunchbase.com/person/martin-blessing-42f2,Individual/Angel,5,,"Hessen, Germany, Europe",,"Martin Blessing is a Chief Executive Officer, Executive Board Member of EFIC1 (European FinTech IPO Company 1).","European Union (EU), Europe, Middle East, and Africa (EMEA)",,,,https://www.linkedin.com/in/martin-blessing/?originalSubdomain=de,5,1,
Nikolaus D. Bayer,https://www.crunchbase.com/person/nikolaus-bayer,Individual/Angel,5,,"Frankfurt, Hessen, Germany",Seed,"Nikolaus invests in early stage ventures focusing on software, artificial intelligence, digitalisation and process optimisation, not only bu...","European Union (EU), Europe, Middle East, and Africa (EMEA)",,,https://www.beai.eu,https://www.linkedin.com/in/nikolausbayer/,5,,
Sven Rittau,https://www.crunchbase.com/person/sven-rittau,Individual/Angel,5,,"Munich, Bayern, Germany",,Sven Rittau is Board Member at i-potentials.,"European Union (EU), Europe, Middle East, and Africa (EMEA)",,,,https://de.linkedin.com/pub/sven-rittau/82/974/87a/en,5,,
Ulf Stahrenberg,https://www.crunchbase.com/person/ulf-stahrenberg,Individual/Angel,5,1,"Berlin, Berlin, Germany",Seed,"Ulf Stahrenberg is a product director at Oply GmbH. Prior to this, Ulf served as chief product officer at MONOQI. He held positions at Zalan...","European Union (EU), Europe, Middle East, and Africa (EMEA)",,,,https://www.linkedin.com/in/ulfstahrenberg,1,,
Alexander Luik,https://www.crunchbase.com/person/alexander-luik,Individual/Angel,5,1,"Düsseldorf, Nordrhein-Westfalen, Germany",,Alexander Luik,"European Union (EU), Europe, Middle East, and Africa (EMEA)",,,,https://www.linkedin.com/in/alexander-luik-a8493aa9/,5,,1
Kristofer Fichtner,https://www.crunchbase.com/person/kristofer-fichtner,Individual/Angel,5,2,"Berlin, Berlin, Germany",,"Kristofer Fichtner is a serial entrepreneur and business Angel with a strong focus on the energy industry, property tech and craft tech. ","European Union (EU), Europe, Middle East, and Africa (EMEA)",,,,https://www.linkedin.com/in/kristoferfichtner/,4,,
Michael Halbherr,https://www.crunchbase.com/person/michael-halbherr,"Individual/Angel, Investment Partner",5,1,"Berlin, Germany, Europe",Seed,Michael Halbherr is the Co-Founder of German Bionic.,"European Union (EU), Europe, Middle East, and Africa (EMEA)",,,,,4,1,
Robert André Kabs,https://www.crunchbase.com/person/robert-kabs,Individual/Angel,5,,"Hamburg, Hamburg, Germany",Seed,Robert André Kabs - Executive Partner @ Kabs PolsterWelt,"European Union (EU), Europe, Middle East, and Africa (EMEA)",,,,https://www.linkedin.com/in/robert-andr%C3%A9-kabs-5baa309,2,1,
