Organization/Person Name,Organization/Person Name URL,Investor Type,Number of Investments,Number of Exits,Location,Investment Stage,Description,Regions,Founded Date,Founded Date Precision,Website,LinkedIn,Number of Portfolio Organizations,Number of Lead Investments,Number of Exits (IPO)
Y Combinator,https://www.crunchbase.com/organization/y-combinator,Accelerator,"7,072",594,"Mountain View, California, United States","Convertible Note, Early Stage Venture, Grant, Late Stage Venture, Non Equity Assistance, Private Equity, Seed, Venture",Y Combinator is a startup accelerator that invests in a wide range of startups.,"San Francisco Bay Area, Silicon Valley, West Coast",2005-03-01,day,http://www.ycombinator.com,https://www.linkedin.com/school/y-combinator,"5,521","2,726",26
Techstars,https://www.crunchbase.com/organization/techstars,"Accelerator, Venture Capital","6,164",515,"Boulder, Colorado, United States","Convertible Note, Early Stage Venture, Non Equity Assistance, Seed, Venture",Techstars is an accelerator that provides pre-seed investment and mentoring for various early stage startups.,"Greater Denver Area, Western US",2006-08-01,day,https://www.techstars.com,https://www.linkedin.com/company/techstars,"4,664","3,245",15
MassChallenge,https://www.crunchbase.com/organization/masschallenge,Accelerator,"3,205",221,"Boston, Massachusetts, United States","Grant, Non Equity Assistance, Seed",MassChallenge is a global non-profit organization that supports startups through accelerator programs.,"Greater Boston Area, East Coast, New England",2009-06-01,day,https://masschallenge.org,https://www.linkedin.com/company/masschallenge,"3,063","1,001",12
500 Global,https://www.crunchbase.com/organization/500-startups,"Accelerator, Angel Group, Micro VC, Venture Capital","3,160",388,"San Francisco, California, United States","Early Stage Venture, Late Stage Venture, Seed, Venture",500 Global is a multi-stage venture capital firm that invests in founders building fast-growing technology companies.,"San Francisco Bay Area, West Coast, Western US",2010-07-30,day,http://500.co,https://www.linkedin.com/company/500global,"2,416",477,20
SOSV,https://www.crunchbase.com/organization/sosv,"Accelerator, Venture Capital","2,815",80,"Princeton, New Jersey, United States","Early Stage Venture, Seed",SOSV is a deep tech venture firm that invests from a startup's inception and operates the HAX and IndieBio programs.,"East Coast, Northeastern US",1994-04-19,day,https://sosv.com,https://www.linkedin.com/company/sosv,"1,413","1,127",8
Plug and Play,https://www.crunchbase.com/organization/plug-and-play-ventures,"Accelerator, Co-Working Space, University Program, Venture Capital","1,951",182,"Sunnyvale, California, United States","Early Stage Venture, Non Equity Assistance, Private Equity, Seed",Plug and Play is an innovation platform bringing together startups and large corporations.,"San Francisco Bay Area, Silicon Valley, West Coast",2006-01-01,year,https://www.plugandplaytechcenter.com,https://www.linkedin.com/company/plug-and-play-tech-center,"1,587",220,11
Alumni Ventures,https://www.crunchbase.com/organization/alumni-ventures-group,"Angel Group, Hedge Fund, Micro VC, Venture Capital","1,877",165,"Manchester, New Hampshire, United States","Convertible Note, Early Stage Venture, Initial Coin Offering, Late Stage Venture, Seed, Venture",Alumni Ventures Group is a venture capital investment firm that manages fund families that invest in a portfolio of companies.,"East Coast, New England, Northeastern US",2014-01-01,year,http://www.av.vc,https://www.linkedin.com/company/alumniventures,"1,413",315,22
Google for Startups,https://www.crunchbase.com/organization/google-for-entrepreneurs,Accelerator,"1,641",78,"Mountain View, California, United States",Non Equity Assistance,Google for Startups is Google’s initiative to help startups thrive across every corner of the world.,"San Francisco Bay Area, Silicon Valley, West Coast",2011-01-01,year,https://startup.google.com,https://www.linkedin.com/showcase/google-for-startups,"1,589","1,536",3
Intel Capital,https://www.crunchbase.com/organization/intel-capital,Corporate Venture Capital,"1,594",504,"Santa Clara, California, United States","Convertible Note, Early Stage Venture, Late Stage Venture, Post-Ipo, Private Equity, Seed, Venture","Intel Capital invests in innovative startups targeting cloud and AI infrastructure, cybersecurity, and other disruptive technologies.","San Francisco Bay Area, Silicon Valley, West Coast",1991-01-01,year,http://www.intelcapital.com,https://www.linkedin.com/company/intelcapital,"1,056",559,89
FJ Labs,https://www.crunchbase.com/organization/fj-labs,"Micro VC, Venture Capital","1,504",99,"New York, New York, United States","Early Stage Venture, Late Stage Venture, Seed, Venture",FJ Labs is a stage-agnostic investment firm that focuses on marketplaces and consumer facing startups.,"Greater New York Area, East Coast, Northeastern US",2015-01-01,year,http://www.fjlabs.com,https://www.linkedin.com/company/fj-labs,975,56,16
Right Side Capital Management,https://www.crunchbase.com/organization/right-side-capital-management,"Micro VC, Venture Capital","1,379",209,"San Francisco, California, United States","Convertible Note, Early Stage Venture, Seed, Venture",Right Side Capital Management is a technology startup investment firm focused exclusively on the pre-seed stage.,"San Francisco Bay Area, West Coast, Western US",2010-01-01,day,http://rightsidecapital.com,https://www.linkedin.com/company/right-side-capital-management,"1,310",51,2
Newchip Accelerator,https://www.crunchbase.com/organization/newchip,"Accelerator, Incubator, Venture Capital","1,291",11,"Austin, Texas, United States","Early Stage Venture, Seed",Newchip is a global remote startup accelerator.,Southern US,2016-01-01,year,https://www.newchip.com,https://www.linkedin.com/company/newchip/,"1,287",26,
Google Ventures,https://www.crunchbase.com/organization/google-ventures,"Corporate Venture Capital, Venture Capital","1,157",257,"San Francisco, California, United States","Convertible Note, Crowdfunding, Early Stage Venture, Late Stage Venture, Post-Ipo, Private Equity, Seed, Venture","Google Ventures is an investment arm of Alphabet that provides seed, venture, and growth-stage funding to technology companies.","San Francisco Bay Area, West Coast, Western US",2009-01-01,year,http://www.gv.com,https://www.linkedin.com/company/googleventures,690,333,64
VentureOut,https://www.crunchbase.com/organization/ventureoutny,"Accelerator, Incubator","1,095",111,"New York, New York, United States","Early Stage Venture, Seed","VentureOut empowers startups to launch, raise capital, and scale, bridging the gap between global innovators and the opportunities in NYC.","Greater New York Area, East Coast, Northeastern US",2012-09-24,day,http://ventureoutny.com,http://www.linkedin.com/company/ventureoutny,"1,089",411,5
Salesforce Ventures,https://www.crunchbase.com/organization/salesforce-ventures,Corporate Venture Capital,763,157,"San Francisco, California, United States","Convertible Note, Early Stage Venture, Late Stage Venture, Post-Ipo, Private Equity, Secondary Market, Seed, Venture",Salesforce Ventures invests in enterprise tech to help companies connect with their customers in entirely new ways.,"San Francisco Bay Area, West Coast, Western US",2009-01-01,year,https://www.salesforceventures.com,https://www.linkedin.com/company/salesforce-ventures,494,167,25
Sand Hill Angels,https://www.crunchbase.com/organization/sand-hill-angels,Angel Group,724,83,"Mountain View, California, United States","Convertible Note, Debt, Early Stage Venture, Late Stage Venture, Seed, Venture",Sand Hill Angels is a group of Silicon Valley angel investors passionate about helping entrepreneurs get to the next level.,"San Francisco Bay Area, Silicon Valley, West Coast",2000-01-01,day,http://www.sandhillangels.com,http://www.linkedin.com/company/sand-hill-angels,388,15,21
Maine Technology Institute,https://www.crunchbase.com/organization/maine-technology-institute,"Government Office, Incubator",715,17,"Brunswick, Maine, United States","Convertible Note, Debt, Early Stage Venture, Grant, Seed, Venture",Maine Technology Institute invests in promising technologies by funding research and development projects in the state's seven.,"East Coast, New England, Northeastern US",1999-01-01,year,http://www.mainetechnology.org,https://www.linkedin.com/company/maine-technology-institute/,286,583,3
Cleantech Open,https://www.crunchbase.com/organization/cleantech-open,Accelerator,679,20,"Palo Alto, California, United States",Early Stage Venture,The Cleantech Open is a non-profit organization that runs an accelerator for cleantech startups.,"San Francisco Bay Area, Silicon Valley, West Coast",2006-01-01,year,http://www.cleantechopen.org,http://www.linkedin.com/company/cleantech-open,676,307,4
Innovation Works,https://www.crunchbase.com/organization/innovation-works,"Government Office, Incubator",631,48,"Pittsburgh, Pennsylvania, United States","Early Stage Venture, Seed","Innovation Works invests capital, business expertise and resources into companies with the greatest likelihood of regional economic impact.","Great Lakes, Northeastern US",1999-01-01,year,http://www.innovationworks.org,http://www.linkedin.com/company/innovation-works,323,83,2
HAX,https://www.crunchbase.com/organization/hax-accelerator,Accelerator,610,15,"San Francisco, California, United States","Convertible Note, Early Stage Venture, Seed",HAX is SOSV's venture program for Hard Tech,"San Francisco Bay Area, West Coast, Western US",2011-09-01,day,http://www.hax.co,https://www.linkedin.com/company/hax,327,10,
Alchemist Accelerator,https://www.crunchbase.com/organization/alchemist-accelerator,Accelerator,605,59,"San Francisco, California, United States","Early Stage Venture, Seed, Venture",The Alchemist Accelerator is a venture-backed initiative focused on accelerating startups whose revenue comes from enterprises.,"San Francisco Bay Area, West Coast, Western US",2012-01-01,year,http://www.alchemistaccelerator.com,https://www.linkedin.com/company/alchemist-accelerator,529,79,1
Tech Coast Angels,https://www.crunchbase.com/organization/tech-coast-angels,Angel Group,582,107,"Newport Beach, California, United States","Early Stage Venture, Late Stage Venture, Seed, Venture",Invests in high-growth start-up's headquartered in Southern California,"Greater Los Angeles Area, West Coast, Western US",1997-04-01,day,http://www.techcoastangels.com,https://www.linkedin.com/company/tech-coast-angels,471,50,16
LAUNCH,https://www.crunchbase.com/organization/launch-co,"Accelerator, Angel Group, Venture Capital",556,54,"San Francisco, California, United States","Convertible Note, Early Stage Venture, Seed",Support founders and inspire innovation,"San Francisco Bay Area, West Coast, Western US",2011-01-01,year,http://launch.co,https://www.linkedin.com/company/launch-calacanis/,344,124,3
FundersClub,https://www.crunchbase.com/organization/fundersclub,"Micro VC, Syndicate",539,105,"San Francisco, California, United States","Early Stage Venture, Seed",FundersClub is an online venture capital firm that focuses on Seed and early stage investments.,"San Francisco Bay Area, West Coast, Western US",2012-07-01,day,http://fundersclub.com,https://www.linkedin.com/company/fundersclub/,394,13,11
gbeta,https://www.crunchbase.com/organization/gbeta,Accelerator,537,12,"Madison, Wisconsin, United States","Non Equity Assistance, Seed","gBETA is a free, seven-week accelerator for early-stage companies with local roots.","Great Lakes, Midwestern US",,,https://www.gener8tor.com/gbeta,https://www.linkedin.com/company/gener8tor,535,376,
IndieBio,https://www.crunchbase.com/organization/synbio-axlr8r,"Accelerator, Venture Capital",529,6,"San Francisco, California, United States","Convertible Note, Early Stage Venture, Seed","IndieBio is the largest biotech startup accelerator, run by SOSV.","San Francisco Bay Area, West Coast, Western US",2014-11-01,day,http://www.indiebio.co,https://www.linkedin.com/company/17958584/,271,16,
Qualcomm Ventures,https://www.crunchbase.com/organization/qualcomm-ventures,Corporate Venture Capital,529,133,"San Diego, California, United States","Convertible Note, Early Stage Venture, Late Stage Venture, Seed",Qualcomm Ventures is a global investor that assists entrepreneurs in creating revolutionary businesses.,"Greater San Diego Area, West Coast, Western US",2000-01-01,year,https://www.qualcommventures.com,https://www.linkedin.com/company/qualcomm-ventures,341,127,24
Edward Lando,https://www.crunchbase.com/person/edward-lando,"Individual/Angel, Investment Partner",523,55,"Miami Beach, Florida, United States",Seed,Edward Lando is the founder of Pareto Holdings. He previously worked at Horizons School of Technology as a co-founder. Edward Lando attended...,"Greater Miami Area, East Coast, Southern US",,,https://www.edwardlando.com,https://www.linkedin.com/in/edwardlando,514,1,2
SkyDeck Berkeley,https://www.crunchbase.com/organization/skydeck-berkeley,Accelerator,485,25,"Berkeley, California, United States","Early Stage Venture, Grant, Non Equity Assistance, Seed",SkyDeck Berkeley is a research university accelerator that serves as an apex startup launchpad for affiliated entrepreneurs.,"San Francisco Bay Area, West Coast, Western US",2012-01-01,year,https://skydeck.berkeley.edu/,https://www.linkedin.com/company/skydeck-berkeley,472,79,
Forum Ventures,https://www.crunchbase.com/organization/forumventures,"Accelerator, Venture Capital",459,38,"New York, New York, United States","Convertible Note, Early Stage Venture, Seed","Forum Ventures is a fund, program, platform, and community for B2B SaaS startups.","Greater New York Area, East Coast, Northeastern US",2012-01-01,day,https://www.forumvc.com/,http://www.linkedin.com/company/forumvc,390,146,
Social Starts,https://www.crunchbase.com/organization/social-starts,"Micro VC, Venture Capital",441,75,"San Francisco, California, United States","Convertible Note, Early Stage Venture, Seed, Venture",Social Starts is a venture capital partnership that invests in companies focusing on emerging science.,"San Francisco Bay Area, West Coast, Western US",2012-01-01,year,http://socialstarts.com,https://www.linkedin.com/company/social-starts,340,10,1
Precursor Ventures,https://www.crunchbase.com/organization/precursor-ventures,"Micro VC, Venture Capital",438,44,"San Francisco, California, United States","Early Stage Venture, Seed",Precursor Ventures invests in people over product at the earliest stage of the entrepreneurial journey.,"San Francisco Bay Area, West Coast, Western US",2015-10-01,month,https://precursorvc.com/,https://www.linkedin.com/company/precursor-ventures/,358,50,
NFX,https://www.crunchbase.com/organization/nfxcapital,"Accelerator, Venture Capital",406,36,"San Francisco, California, United States","Early Stage Venture, Seed",NFX operates as a pre-seed and seed stage VC that is transforming how true innovators are funded.,"San Francisco Bay Area, West Coast, Western US",2015-06-01,day,http://www.nfx.com,https://www.linkedin.com/company/nfx-guild/,270,204,3
AcceliCITY powered by Leading Cities,https://www.crunchbase.com/organization/accelicity,Accelerator,402,13,"Boston, Massachusetts, United States",Non Equity Assistance,"Leading Cities' AcceliCITY is among the Top 5 Govtech accelerators globally serving sustainability, resiliency & other smart city solutions.","Greater Boston Area, East Coast, New England",2010-01-01,year,https://leadingcities.org/,https://www.linkedin.com/company/leading-cities/,381,1,2
Coinbase Ventures,https://www.crunchbase.com/organization/coinbase-ventures,Corporate Venture Capital,401,15,"Oakland, California, United States","Early Stage Venture, Initial Coin Offering, Late Stage Venture, Seed, Venture",Coinbase Ventures is an investment arm of Coinbase that aims to invest in seed-stage cryptocurrency and blockchain startups.,"San Francisco Bay Area, West Coast, Western US",2018-01-01,year,https://ventures.coinbase.com,https://www.linkedin.com/company/coinbase,355,27,1
(ERA) Entrepreneurs Roundtable Accelerator,https://www.crunchbase.com/organization/er-accelerator,"Accelerator, Venture Capital",395,36,"New York, New York, United States","Early Stage Venture, Seed",(ERA) Entrepreneurs Roundtable Accelerator is an early-stage venture capital fund and technology accelerator.,"Greater New York Area, East Coast, Northeastern US",2011-01-01,year,http://eranyc.com,https://www.linkedin.com/company/er-accelerator/,344,2,1
MedTech Innovator,https://www.crunchbase.com/organization/medtechinnovator,Accelerator,391,23,"Los Angeles, California, United States","Early Stage Venture, Grant, Late Stage Venture, Non Equity Assistance, Seed, Venture","MedTech Innovator is the largest lifescience accelerator in the world for medical device, digital health, and diagnostic companies.","Greater Los Angeles Area, West Coast, Western US",2013-01-01,year,https://medtechinnovator.org/,https://www.linkedin.com/company/medtech-innovator/,382,203,1
ff Venture Capital,https://www.crunchbase.com/organization/ff-venture-capital,"Micro VC, Venture Capital",374,35,"New York, New York, United States","Debt, Early Stage Venture, Late Stage Venture, Seed","ff Venture Capital is a technology venture capital firm that invests in cybersecurity, AI, machine learning, drones, and cloud software.","Greater New York Area, East Coast, Northeastern US",2008-12-01,day,http://www.ffvc.com,https://www.linkedin.com/company/ff-venture-capital,154,64,3
Comcast Ventures,https://www.crunchbase.com/organization/comcast-interactive-capital,Corporate Venture Capital,371,111,"San Francisco, California, United States","Debt, Early Stage Venture, Late Stage Venture, Private Equity, Seed, Venture",Comcast Ventures partners with extraordinary entrepreneurs building transformative consumer and enterprise companies.,"San Francisco Bay Area, West Coast, Western US",1999-01-01,year,http://www.comcastventures.com,https://www.linkedin.com/company/comcast-ventures/,240,98,15
Accomplice,https://www.crunchbase.com/organization/accomplice-atlas-venture,"Family Investment Office, Venture Capital",369,72,"Cambridge, Massachusetts, United States","Early Stage Venture, Initial Coin Offering, Late Stage Venture, Seed, Venture",Accomplice is a seed-led venture capital firm that primarily invests in technology startup companies.,"Greater Boston Area, East Coast, New England",2015-03-01,day,https://accomplice.co,https://www.linkedin.com/company/accomplice-vc,231,95,9
Village Global,https://www.crunchbase.com/organization/village-global-2,"Micro VC, Venture Capital",364,19,"Covina, California, United States","Early Stage Venture, Late Stage Venture, Seed, Venture",Village Global is an early stage venture capital firm and accelerator backed by some of the world's most successful entrepreneurs.,"Greater Los Angeles Area, West Coast, Western US",2017-01-01,year,http://www.villageglobal.vc/,https://www.linkedin.com/company/18265228/,284,63,
Village Capital,https://www.crunchbase.com/organization/village-capital,"Accelerator, Entrepreneurship Program, Venture Capital",357,24,"Washington, District of Columbia, United States","Convertible Note, Debt, Early Stage Venture, Private Equity, Seed",Village Capital builds bridges for entrepreneurs who are creating an inclusive and sustainable world.,"Washington DC Metro Area, Southern US",2009-01-01,year,http://www.vilcap.com,http://www.linkedin.com/company/village-capital,348,158,
Endeavor Catalyst,https://www.crunchbase.com/organization/endeavor-catalyst,"Corporate Venture Capital, Venture Capital",355,46,"New York, New York, United States","Early Stage Venture, Late Stage Venture, Seed, Venture",Endeavor Catalyst is a co-investment fund that invests in qualifying rounds of $5M+ raised by Endeavor Entrepreneurs.,"Greater New York Area, East Coast, Northeastern US",2012-01-01,day,https://endeavor.org/catalyst/,https://www.linkedin.com/showcase/endeavor-catalyst/,321,11,12
Thrive Capital,https://www.crunchbase.com/organization/thrive-capital,"Incubator, Venture Capital",354,74,"New York, New York, United States","Early Stage Venture, Late Stage Venture, Seed","Thrive Capital is an investment firm that builds and invests in internet, software, and technology-enabled companies.","Greater New York Area, East Coast, Northeastern US",2009-01-01,year,http://thrivecap.com,https://www.linkedin.com/company/thrive-capital,196,115,16
Samsung NEXT,https://www.crunchbase.com/organization/samsungnext,"Corporate Venture Capital, Venture Capital",350,41,"Mountain View, California, United States","Early Stage Venture, Late Stage Venture, Seed, Venture",Samsung NEXT invests in transformative seed-stage software and services startups.,"San Francisco Bay Area, Silicon Valley, West Coast",2013-07-01,day,http://samsungnext.com,https://www.linkedin.com/company/samsung-next,279,27,2
Bill & Melinda Gates Foundation,https://www.crunchbase.com/organization/bill-melinda-gates-foundation,Family Investment Office,341,69,"New York, New York, United States","Early Stage Venture, Grant, Late Stage Venture","Bill & Melinda Gates Foundation supports initiatives in education, world health and population, and community giving.","Greater New York Area, East Coast, Northeastern US",1997-01-01,day,http://www.gatesfoundation.org,http://www.linkedin.com/company/bill-&-melinda-gates-foundation,269,244,46
StartX (Stanford-StartX Fund),https://www.crunchbase.com/organization/stanfordstartx-fund,"Accelerator, Venture Capital",338,76,"Palo Alto, California, United States","Convertible Note, Debt, Early Stage Venture, Grant, Non Equity Assistance, Seed, Venture",StartX is an educational non-profit that helps Stanford's top entrepreneurs.,"San Francisco Bay Area, Silicon Valley, West Coast",2011-01-01,year,http://startx.com/,https://www.linkedin.com/company/startx-,291,5,8
Connecticut Innovations,https://www.crunchbase.com/organization/connecticut-innovations,"Government Office, Venture Capital, Venture Debt",324,53,"Rocky Hill, Connecticut, United States","Debt, Early Stage Venture, Grant, Late Stage Venture, Seed, Venture",Connecticut Innovations provides strategic capital and operational insight to to companies in high-tech industries,"East Coast, New England, Northeastern US",1995-01-01,year,http://www.ctinnovations.com,http://www.linkedin.com/company/67435,241,105,12
Keiretsu Forum,https://www.crunchbase.com/organization/keiretsu-forum,"Angel Group, Venture Capital",322,45,"Orinda, California, United States","Debt, Early Stage Venture, Late Stage Venture, Seed","Keiretsu Forum is a California-based angel group that offers early, seed, and later stage venture, and debt financing investments.","San Francisco Bay Area, West Coast, Western US",2000-09-01,day,http://www.keiretsuforum.com,http://www.linkedin.com/company/keiretsu-forum,288,30,11
New York Angels,https://www.crunchbase.com/organization/new-york-angels,Angel Group,321,73,"New York, New York, United States","Convertible Note, Early Stage Venture, Late Stage Venture, Seed, Venture","New York Angels is a professional angel organization that finds, funds, and mentors companies from pitch through successful exit.","Greater New York Area, East Coast, Northeastern US",2004-01-01,year,http://www.newyorkangels.com,http://www.linkedin.com/company/1450029,265,30,5
IQT,https://www.crunchbase.com/organization/in-q-tel,"Accelerator, Government Office",314,108,"Arlington, Virginia, United States","Debt, Early Stage Venture, Grant, Late Stage Venture, Seed",IQT identifies and partners with companies developing cutting-edge technologies to help deliver solutions.,"Washington DC Metro Area, East Coast, Southern US",1999-01-01,year,https://www.iqt.org,https://www.linkedin.com/company/in-q-tel,259,75,18
Tuesday Capital,https://www.crunchbase.com/organization/tuesday-capital,"Micro VC, Venture Capital",314,102,"San Francisco, California, United States","Early Stage Venture, Late Stage Venture, Seed, Venture",Tuesday Capital is a VC firm that invests in companies and maintains a variety of relationships with other VC firms.,"San Francisco Bay Area, West Coast, Western US",2011-09-01,day,http://tuesday.vc,https://www.linkedin.com/company/tuesdaycapital/,251,15,16
Lighter Capital,https://www.crunchbase.com/organization/lighter-capital,Venture Debt,314,53,"Seattle, Washington, United States","Debt, Early Stage Venture",Lighter Capital offers tech entrepreneurs with access to non-dilutive financing to help grow their companies without giving up equity.,"Greater Seattle Area, West Coast, Western US",2010-06-01,day,https://www.lightercapital.com,https://www.linkedin.com/company/lighter-capital,206,123,
M12 - Microsoft's Venture Fund,https://www.crunchbase.com/organization/m12,"Corporate Venture Capital, Venture Capital",309,39,"San Francisco, California, United States","Convertible Note, Early Stage Venture, Late Stage Venture, Post-Ipo, Seed, Venture",M12 is the venture capital arm of Microsoft that invests in early-stage companies.,"San Francisco Bay Area, West Coast, Western US",2016-05-30,day,https://m12.vc,https://www.linkedin.com/company/m12vc,163,98,5
Ulu Ventures,https://www.crunchbase.com/organization/ulu-ventures,"Micro VC, Venture Capital",296,44,"Palo Alto, California, United States","Early Stage Venture, Seed",Ulu Ventures primarily operates as a seed-stage venture fund.,"San Francisco Bay Area, Silicon Valley, West Coast",2008-01-01,year,http://www.uluventures.com,https://www.linkedin.com/company/ulu-ventures,210,41,4
