Biz Stone,https://www.crunchbase.com/person/biz-stone,"Individual/Angel, Investment Partner",53,12,"San Francisco, California, United States",,"Biz Stone is the Co-founder and CEO of Jelly Industries, Inc. He previously worked at The Obvious Corporation as a Co-founder and Chief Crea...","San Francisco Bay Area, West Coast, Western US",,,https://18salisbury.capital,https://www.linkedin.com/in/bizstone,43,2,4
Startup Capital Ventures,https://www.crunchbase.com/organization/startup-capital-ventures,"Micro VC, Venture Capital",53,15,"Menlo Park, California, United States","Early Stage Venture, Seed",Startup Capital Ventures is an early-stage venture capital firm investing in the enterprise.,"San Francisco Bay Area, Silicon Valley, West Coast",2005-01-01,year,http://www.startupcv.com,http://www.linkedin.com/company/startup-capital-ventures,34,11,1
Talent Resources Ventures,https://www.crunchbase.com/organization/talent-resources-ventures,"Accelerator, Venture Capital",53,12,"New York, New York, United States","Early Stage Venture, Seed, Venture",Talent Resources Ventures is a boutique venture fund focused on early-stage consumer facing brands.,"Greater New York Area, East Coast, Northeastern US",2019-01-01,year,https://www.tr.ventures,https://www.linkedin.com/company/tr-ventures/,51,2,7
Red Rock Ventures,https://www.crunchbase.com/organization/red-rock-ventures,Micro VC,53,18,"Palo Alto, California, United States","Early Stage Venture, Late Stage Venture, Seed",Red Rock Ventures is a venture capital investment firm that invests in seed and early-stage information technology companies.,"San Francisco Bay Area, Silicon Valley, West Coast",1997-01-01,year,http://www.redrockventures.com,,29,9,2
Jonathan Weiner,https://www.crunchbase.com/person/jonathan-weiner,"Individual/Angel, Investment Partner",53,8,"New York, New York, United States","Early Stage Venture, Late Stage Venture, Seed, Venture",Jonathan Weiner is the Founder of HumanX. He previously worked at FastPay as a Board Member. Jonathan Weiner attended the University of Mass...,"Greater New York Area, East Coast, Northeastern US",,,http://www.hlth.com,http://www.linkedin.com/in/writejw,51,,
Counterpart Advisors,https://www.crunchbase.com/organization/counterpart-advisors-venture-capitalist-llc,"Family Investment Office, Private Equity Firm, Venture Capital",53,15,"Manhattan Beach, California, United States","Early Stage Venture, Late Stage Venture, Seed","Counterpart Advisors is a Venture Capital, Private Equity & Consulting firm that engages in highly competitive and visible markets.","Greater Los Angeles Area, West Coast, Western US",2017-01-01,year,http://counterpartadvisors.com,https://www.linkedin.com/company/counterpart-advisors-vc/,52,,12
Lighthouse Capital Partners,https://www.crunchbase.com/organization/lighthouse-capital-partners,Incubator,53,25,"Menlo Park, California, United States","Debt, Early Stage Venture, Late Stage Venture, Private Equity","Lighthouse Capital Partners provides capital to early- and growth-stage technology, life science and clean tech companies.","San Francisco Bay Area, Silicon Valley, West Coast",1994-01-01,year,http://www.lcpartners.com,,44,4,7
Cardinal Venture Capital,https://www.crunchbase.com/organization/cardinal-venture-capital,Micro VC,53,17,"Menlo Park, California, United States","Debt, Early Stage Venture, Late Stage Venture, Private Equity","Cardinal Venture Capital invests in digital media, financial technology, mobility and software-as-a-service.","San Francisco Bay Area, Silicon Valley, West Coast",2000-01-01,year,http://www.cardinalvc.com,,26,11,1
Imagine K12,https://www.crunchbase.com/organization/imagine-k12,Accelerator,53,14,"Redwood City, California, United States","Early Stage Venture, Seed","Imagine K12 invests time, experience, energy and resources in companies that create products and services for the education industry.","San Francisco Bay Area, Silicon Valley, West Coast",2011-03-17,day,http://www.imaginek12.com,https://www.linkedin.com/company/imagine-k12/,47,2,1
Hub Angels Investment Group,https://www.crunchbase.com/organization/hub-angels-investment-group,Angel Group,53,23,"Boston, Massachusetts, United States","Early Stage Venture, Seed",Hub Angels Investment Group is an angel group structured as a fund that helps companies to be more successful.,"Greater Boston Area, East Coast, New England",2000-03-01,day,http://www.hubangels.com,https://www.linkedin.com/company/hub-angels/,48,5,2
Jonathan Keidan,https://www.crunchbase.com/person/jonathan-keidan,"Individual/Angel, Investment Partner",53,13,"New York, New York, United States","Early Stage Venture, Seed","Jonathan is the Founder of Torch Capital. A long time entrepreneur and investor, he has spent his career at the intersection of the media, t...","Greater New York Area, East Coast, Northeastern US",,,,https://www.linkedin.com/in/jonathan-keidan-b76515/,41,,3
Ratan Tata,https://www.crunchbase.com/person/ratan-n-tata,"Individual/Angel, Investment Partner",53,8,"Houston, Texas, United States",Seed,Ratan Tata is the Founder and Managing Director of RNT Associates.,"Greater Houston Area, Southern US",,,,http://www.linkedin.com/pub/sir-ratan-naval-tata/53/985/b15,43,20,3
Pfizer,https://www.crunchbase.com/organization/pfizer,"Corporate Venture Capital, Venture Capital",52,19,"New York, New York, United States","Private Equity, Venture","Pfizer is a biopharmaceutical company that provides affordable access to safe, effective medicines and health care services.","Greater New York Area, East Coast, Northeastern US",1849-01-01,year,http://www.pfizer.com,http://www.linkedin.com/company/pfizer,46,22,16
Michael Ovitz,https://www.crunchbase.com/person/michael-ovitz,"Individual/Angel, Investment Partner",52,10,"Beverly Hills, California, United States",Seed,"Michael Ovitz co-founded Creative Artists Agency (CAA) in 1974 and served as its Chairman until 1995. Over that 20-year period, he grew the ...","Greater Los Angeles Area, West Coast, Western US",,,http://www.michaelovitz.com,http://www.linkedin.com/in/mikeovitz,51,,1
SAIC Venture Capital,https://www.crunchbase.com/organization/saic-venture-capital,Corporate Venture Capital,52,17,"Las Vegas, Nevada, United States","Early Stage Venture, Late Stage Venture, Seed, Venture","SAIC Venture Capital Corporation is a venture capital investment arm of SAIC, Inc. It specializes in investments in seed, startup, early",Western US,2000-01-01,year,https://saicvc.com/,https://www.linkedin.com/company/saic-capital/about/,46,9,3
Pappas Ventures,https://www.crunchbase.com/organization/pappas-ventures,Micro VC,52,24,"Durham, North Carolina, United States","Early Stage Venture, Late Stage Venture, Private Equity",Pappas Ventures provides investment in the life sciences sector.,"Research Triangle, East Coast, Southern US",1994-01-01,year,http://www.pappasventures.com,http://www.linkedin.com/company/pappas-ventures,36,4,13
Financial Solutions Lab,https://www.crunchbase.com/organization/financial-solutions-lab,Accelerator,52,11,"Chicago, Illinois, United States","Early Stage Venture, Seed",The Financial Solutions Lab is a catalyst for innovations that improve financial health.,"Greater Chicago Area, Great Lakes, Midwestern US",2014-01-01,year,http://finlab.finhealthnetwork.org/,,50,13,1
Pasadena Angels,https://www.crunchbase.com/organization/pasadena-angels,Angel Group,52,10,"Altadena, California, United States","Early Stage Venture, Late Stage Venture, Seed, Venture","The Pasadena Angels, ranked a Top Ten angel group by Forbes, has invested $65+ million in over 175 companies.","Greater Los Angeles Area, West Coast, Western US",2000-01-01,year,http://www.pasadenaangels.com,http://www.linkedin.com/company/pasadena-angels,45,11,
Dylan Taylor,https://www.crunchbase.com/person/dylan-taylor,"Individual/Angel, Investment Partner",51,8,"Denver, Colorado, United States","Early Stage Venture, Late Stage Venture, Seed, Venture","Dylan Taylor is a global business leader, commercial astronaut, thought leader and philanthropist. Currently, Dylan serves as Chairman & CEO...","Greater Denver Area, Western US",,,http://dylantaylor.org,https://www.linkedin.com/in/taylordylan,37,2,1
Heroic Ventures,https://www.crunchbase.com/organization/heroic-ventures,Micro VC,51,6,"Palo Alto, California, United States","Early Stage Venture, Seed",Heroic Ventures is an early stage venture capital firm.,"San Francisco Bay Area, Silicon Valley, West Coast",2016-01-01,year,http://www.heroicvc.com,https://www.linkedin.com/company/heroic-ventures,41,9,
Avant Global,https://www.crunchbase.com/organization/avant-global,"Family Investment Office, Hedge Fund, Private Equity Firm, Venture Capital",51,10,"Las Vegas, Nevada, United States","Convertible Note, Early Stage Venture, Late Stage Venture, Non Equity Assistance, Private Equity, Seed, Venture",Avant Global is a relationship-driven private investment firm founded in 1999 to manage assets of a single family.,Western US,1999-01-01,year,http://avantglobal.com/,https://www.linkedin.com/company/avant-global-llc/,45,1,3
Deep Fork Capital,https://www.crunchbase.com/organization/deep-fork-capital-2,"Micro VC, Venture Capital",51,15,"San Francisco, California, United States","Early Stage Venture, Seed",Deep Fork Capital (DFC) is a $30mm seed-focused venture capital fund with presences in San Francisco and New York.,"San Francisco Bay Area, West Coast, Western US",2008-01-01,day,http://www.deepforkcapital.com,https://www.linkedin.com/company/deep-fork-capital,38,8,2
Kevin Durant,https://www.crunchbase.com/person/kevin-durant,"Individual/Angel, Investment Partner",51,5,"Oakland, California, United States",Seed,Kevin Durant is a 12-year NBA veteran who plays for the Brooklyn Nets.  He is a 2x NBA Champion and Finals MVP; having also won an NBA MVP A...,"San Francisco Bay Area, West Coast, Western US",,,,https://www.linkedin.com/in/kevin-durant-3a66178b,44,,
Jeff Weiner,https://www.crunchbase.com/person/jeff-weiner,"Individual/Angel, Investment Partner",51,9,"Mountain View, California, United States",Seed,"Jeff Weiner is the executive chairman of LinkedIn, where he continues to help LinkedIn realize its vision of creating economic opportunity f...","San Francisco Bay Area, Silicon Valley, West Coast",,,http://blog.linkedin.com,http://www.linkedin.com/in/jeffweiner08,44,1,2
Golden Angels Investors,https://www.crunchbase.com/organization/golden-angels-investors,Angel Group,50,6,"Brookfield, Wisconsin, United States","Debt, Early Stage Venture, Non Equity Assistance, Seed",Golden Angels Investors is an angel investment group making investments in entrepreneurial ventures.,"Great Lakes, Midwestern US",2002-10-01,day,http://goldenangelsinvestors.com,https://www.linkedin.com/company/golden-angels-network/,34,12,
Thomas Glocer,https://www.crunchbase.com/person/tom-glocer,"Individual/Angel, Investment Partner",50,16,"New York, New York, United States",Seed,Tom Glocer joined BlueVoyant as Executive Chairman and Founder in 2017.,"Greater New York Area, East Coast, Northeastern US",,,http://tomglocer.com,https://www.linkedin.com/in/tom-glocer-66729/,42,2,
Bradley C. Harrison,https://www.crunchbase.com/person/bradley-c-harrison,"Individual/Angel, Investment Partner",50,16,"Austin, Texas, United States","Early Stage Venture, Seed","Brad is an entrepreneur and seasoned business development executive with a passion for technology, media, entertainment and lifestyle. Brad ...",Southern US,,,,http://www.linkedin.com/in/bradharrison,36,,
DFO Management,https://www.crunchbase.com/organization/msd-capital,Family Investment Office,50,17,"New York, New York, United States","Early Stage Venture, Late Stage Venture, Private Equity, Venture",DFO Management is a private investment firm that engages in a broad range of investment activities.,"Greater New York Area, East Coast, Northeastern US",1998-01-01,year,https://www.dellfamilyoffice.com,https://www.linkedin.com/company/msd-capital,42,8,7
Michael Seibel,https://www.crunchbase.com/person/michael-seibel,"Individual/Angel, Investment Partner",49,11,"San Francisco, California, United States",Seed,Michael Seibel is the Managing Director and Group Partner of Y Combinator. He previously worked at Socialcam as a CEO. Michael Seibel attend...,"San Francisco Bay Area, West Coast, Western US",,,https://michaelseibel.com,https://www.linkedin.com/in/mwseibel,45,,
Knoll Ventures,https://www.crunchbase.com/organization/knoll-ventures,Micro VC,49,14,"Atlanta, Georgia, United States","Early Stage Venture, Seed",Knoll Ventures is an early-stage venture capital firm that invests in B2B technology enabled companies prior to the Series A round.,"Greater Atlanta Area, East Coast, Southern US",2018-01-01,year,http://www.knollventures.com,https://www.linkedin.com/company/knoll-ventures/about/,35,6,
EDF Ventures,https://www.crunchbase.com/organization/edf-ventures,"Government Office, Micro VC",49,15,"Ann Arbor, Michigan, United States","Early Stage Venture, Late Stage Venture",EDF Ventures is a leading venture capital firm investing in early-stage healthcare companies.,"Great Lakes, Midwestern US",1987-01-01,year,http://www.edfvc.com,,30,4,4
Euclidean Capital,https://www.crunchbase.com/organization/euclidean-capital,"Family Investment Office, Hedge Fund",49,5,"New York, New York, United States","Early Stage Venture, Late Stage Venture, Seed, Venture",Euclidean Capital is an investment firm that invests in individual and family services management.,"Greater New York Area, East Coast, Northeastern US",2009-01-01,year,,https://www.linkedin.com/company/euclidean-capital-llc,34,4,4
ic@3401,https://www.crunchbase.com/organization/ic-3401,"Accelerator, Incubator, Startup Competition",49,11,"Philadelphia, Pennsylvania, United States","Crowdfunding, Early Stage Venture, Grant, Non Equity Assistance, Seed","This is the largest group of funded, early-stage software companies in Philadelphia.","Greater Philadelphia Area, Great Lakes, Northeastern US",2014-06-01,day,http://www.ic3401.org,,49,1,
Restive,https://www.crunchbase.com/organization/financial-venture-studio,"Incubator, Venture Capital",49,10,"San Francisco, California, United States","Early Stage Venture, Seed",Restive is an early-stage fintech investment venture capital.,"San Francisco Bay Area, West Coast, Western US",2018-01-01,year,https://www.restive.com/,https://www.linkedin.com/company/restiveventures/,40,5,
Summer@Highland,https://www.crunchbase.com/organization/summer-highland,Accelerator,49,14,"Boston, Massachusetts, United States",,"Summer@Highland provides mentoring, office space, and resources for student-founded start-ups.","Greater Boston Area, East Coast, New England",2007-01-01,year,http://summer.hcp.com,,49,46,
USAA,https://www.crunchbase.com/organization/usaa,Corporate Venture Capital,49,16,"San Antonio, Texas, United States","Early Stage Venture, Late Stage Venture",USAA is a financial services company.,Southern US,1922-01-01,year,https://www.usaa.com,https://www.linkedin.com/company/usaa,38,19,3
Slater Technology Fund,https://www.crunchbase.com/organization/slater-technology-fund,"Government Office, Incubator",48,9,"Providence, Rhode Island, United States","Early Stage Venture, Late Stage Venture, Seed",Slater Technology Fund is a venture capital firm investing in technology-based startup companies across multiple sectors.,"East Coast, New England, Northeastern US",1997-01-01,year,http://www.slaterfund.com,https://www.linkedin.com/company/4029977?trk=tyah&trkInfo=clickedVertical%3Acompany%2CclickedEntityId%3A4029977%2Cidx%3A1-1-1%2CtarId%3A1442417656390%2Ctas%3ASlater%20Technology%20Fund,38,15,
David O. Sacks,https://www.crunchbase.com/person/david-sacks,"Individual/Angel, Investment Partner",48,18,"San Francisco, California, United States",Seed,"David O. Sacks is the Co-Founder and Partner of Craft Ventures. He previously worked at Zenefits as an Investor, COO, and Interim CEO. David...","San Francisco Bay Area, West Coast, Western US",,,https://shrt.autos/crunch,https://www.linkedin.com/in/davidoliversacks,45,5,5
Girish Mathrubootham,https://www.crunchbase.com/person/girish-mathrubootham,"Individual/Angel, Investment Partner",48,9,"Burlingame, California, United States",Seed,Girish Mathrubootham is the CEO and Founder at Freshworks. Girish Mathrubootham attended University of Madras.,"San Francisco Bay Area, West Coast, Western US",,,,http://www.linkedin.com/in/girish1,44,2,
Jeremy Stoppelman,https://www.crunchbase.com/person/jeremy-stoppelman,"Individual/Angel, Investment Partner",48,17,"San Francisco, California, United States",Seed,Jeremy Stoppelman is the Co-founder and CEO of Yelp. He previously worked at PayPal an eBay Company as a VP of Engineering. Jeremy Stoppelma...,"San Francisco Bay Area, West Coast, Western US",,,,http://www.linkedin.com/in/jeremystoppelman,41,,7
Nebraska Angel Network,https://www.crunchbase.com/organization/nebraska-angel-network,Angel Group,48,6,"Lincoln, Nebraska, United States","Early Stage Venture, Seed",Nebraska Angel Network is a local angel investor that finances early-stage high-growth companies.,Midwestern US,2006-01-01,year,http://www.nebraskaangels.org/,https://www.linkedin.com/company/nebraska-angels,44,19,
MDC Ventures,https://www.crunchbase.com/organization/kbs-p-ventures,"Corporate Venture Capital, Venture Capital",48,15,"New York, New York, United States","Early Stage Venture, Seed","MDC Ventures is the corporate venture arm of MDC Partners, a global advertising holding company.","Greater New York Area, East Coast, Northeastern US",2010-12-01,day,http://mdcventures.vc/,https://www.linkedin.com/in/jessicapeltz,38,6,
MedImmune Ventures,https://www.crunchbase.com/organization/medimmune-ventures,Corporate Venture Capital,48,13,"Gaithersburg, Maryland, United States",,"MedImmune Ventures invests in early to late stage, public and private biotechnology companies.","Washington DC Metro Area, East Coast, Southern US",1987-01-01,year,http://medimmuneventures.com,,27,8,7
FG Angels,https://www.crunchbase.com/organization/fg-angels,Angel Group,48,17,"Boulder, Colorado, United States",Seed,"FG Angels is part of the Foundry Group, a venture capital firm.","Greater Denver Area, Western US",2014-01-01,year,https://www.foundrygroup.com/team,,46,19,
A-Grade Investments,https://www.crunchbase.com/organization/a-grade-investments,Angel Group,48,27,"West Hollywood, California, United States","Debt, Early Stage Venture, Seed","A-Grade Investments is a venture capital fund founded by long-time friends Ashton Kutcher, Guy Oseary, and Ron Burkle.","Greater Los Angeles Area, West Coast, Western US",2010-01-01,year,http://www.agradeinvestments.com/,https://www.linkedin.com/company/a-grade-investments/about/,44,2,6
Monroe Capital,https://www.crunchbase.com/organization/monroe-capital,Venture Debt,47,22,"Chicago, Illinois, United States",Debt,Monroe Capital is an asset management firm that provides private credit solutions to borrowers.,"Greater Chicago Area, Great Lakes, Midwestern US",2004-10-12,day,http://www.monroecap.com,http://www.linkedin.com/company/83354,42,24,7
MRL Ventures Fund,https://www.crunchbase.com/organization/mrl-venture-fund,"Corporate Venture Capital, Venture Capital",47,13,"Cambridge, Massachusetts, United States","Early Stage Venture, Seed, Venture",MRL Ventures is Merck’s independent early-stage therapeutics venture capital fund.,"Greater Boston Area, East Coast, New England",2014-01-01,day,http://www.mrlv.com,https://www.linkedin.com/company/mrl-ventures-fund-llc/,30,7,9
Wipro Ventures,https://www.crunchbase.com/organization/wiproventure,Corporate Venture Capital,47,8,"Mountain View, California, United States",Early Stage Venture,Wipro Ventures is the strategic investment arm of Wipro Ltd. (NYSE: WIT) and focuses on investing in early- to mid-stage startups.,"San Francisco Bay Area, Silicon Valley, West Coast",2015-01-01,year,http://www.wipro.com/ventures/,https://www.linkedin.com/showcase/26474360/admin/,29,7,
Recursive Ventures,https://www.crunchbase.com/organization/recursive-ventures,"Micro VC, Venture Capital",47,10,"Albany, California, United States","Early Stage Venture, Seed",Recursive Ventures invests in US and Israeli Seed Tech Startups disrupting industries through use of Data and AI,"San Francisco Bay Area, West Coast, Western US",2015-03-04,day,http://www.recursiveventures.com,http://www.linkedin.com/company/recursive-ventures,42,2,2
NCT Ventures,https://www.crunchbase.com/organization/nct-ventures-funds-i,Micro VC,47,12,"Columbus, Ohio, United States","Early Stage Venture, Seed",NCT backs seed and early stage technology companies that are disrupting major industries. ,"Great Lakes, Midwestern US",2000-10-03,day,http://www.nctventures.com,http://www.linkedin.com/company/nct-ventures,39,11,
SierraMaya360,https://www.crunchbase.com/organization/sierramaya360-2,"Micro VC, Venture Capital",47,13,"Los Angeles, California, United States",Early Stage Venture,SierraMaya360 is a full-service early stage venture capital firm.,"Greater Los Angeles Area, West Coast, Western US",2013-04-01,day,http://www.sierramaya360.vc,http://www.linkedin.com/company/sierra-maya-ventures,39,4,2
Paige Craig,https://www.crunchbase.com/person/paige-craig,"Individual/Angel, Investment Partner",47,19,"Los Angeles, California, United States",Seed,Paige Craig Is The Partner at Outlander.He attend to the United States Military Academy at West PointUnited States Military Academy at West ...,"Greater Los Angeles Area, West Coast, Western US",,,,http://www.linkedin.com/in/paigecraig,41,2,1
Constance Freedman,https://www.crunchbase.com/person/constance-freedman,"Individual/Angel, Investment Partner",47,18,"Chicago, Illinois, United States",,Constance Freedman is the Member Board Of Directors at Equity LifeStyle Properties.,"Greater Chicago Area, Great Lakes, Midwestern US",,,,http://www.linkedin.com/in/cfreedman,43,,4
Solstice Capital,https://www.crunchbase.com/organization/solstice-capital,Micro VC,47,17,"Salem, Massachusetts, United States","Early Stage Venture, Late Stage Venture",Solstice Capital seeks superior venture capital returns for its limited partners through investments in seed- and early-stage companies in,"Greater Boston Area, East Coast, New England",1995-01-01,year,http://www.solcap.com,,23,4,1
Josh Buckley,https://www.crunchbase.com/person/josh-buckley,"Individual/Angel, Investment Partner",46,7,"San Francisco, California, United States",,Josh Buckley is the CEO of Product Hunt.,"San Francisco Bay Area, West Coast, Western US",,,https://joshbuckley.co/,http://www.linkedin.com/pub/josh-buckley/4/228/761,41,6,
The Refiners,https://www.crunchbase.com/organization/therefiners,Accelerator,46,6,"San Francisco, California, United States","Early Stage Venture, Seed",The Refiners is a San Francisco-based seed fund program devoted to helping world-class entrepreneurs thrive in Silicon Valley.,"San Francisco Bay Area, West Coast, Western US",2016-05-01,month,http://www.therefiners.co/,https://www.linkedin.com/company/the-refiners/,43,4,
Jason Calacanis,https://www.crunchbase.com/person/jason-calacanis,"Individual/Angel, Investment Partner",46,16,"San Francisco, California, United States",Seed,Jason Calacanis is the Founder and CEO of Inside.com and Launch. He previously worked at Weblogs as a Co-Founder and CEO. Jason Calacanis at...,"San Francisco Bay Area, West Coast, Western US",,,https://18salisbury.capital,https://www.linkedin.com/in/jasoncalacanis,44,3,1
Qbic Fund,https://www.crunchbase.com/organization/qbic-fund,"Micro VC, Venture Capital",46,9,"Belgium, Wisconsin, United States","Early Stage Venture, Seed","Qbic Fund is a multi-sector fund supporting spin-off companies of the Ghent, Brussels, Antwerp.","Great Lakes, Midwestern US",2012-05-01,day,http://qbic.be/,https://www.linkedin.com/company/qbic,33,14,1
Drummond Road Capital,https://www.crunchbase.com/organization/drummond-road-capital,"Micro VC, Venture Capital",46,14,"Cleveland, Ohio, United States","Early Stage Venture, Seed",Funding the Gap Between Angel and Institutional Venture Capital,"Great Lakes, Midwestern US",1999-01-01,year,http://www.drummondroad.com,http://www.linkedin.com/in/mowheeler,37,2,
Michael Stoppelman,https://www.crunchbase.com/person/michael-stoppelman,"Individual/Angel, Investment Partner",46,6,"Santa Monica, California, United States",Seed,Michael Stoppelman is an active angel/seed investor in Los Angeles. He's the former Senior Vice President of Engineering at Yelp. He started...,"Greater Los Angeles Area, West Coast, Western US",,,,http://www.linkedin.com/in/michaelstoppelman,45,,1
Healthy Ventures,https://www.crunchbase.com/organization/healthy-ventures,"Micro VC, Venture Capital",46,7,"Westlake Village, California, United States","Early Stage Venture, Seed","Purpose-built, early-stage venture investor focused on health tech","Greater Los Angeles Area, West Coast, Western US",2015-02-01,day,http://healthy.vc,https://www.linkedin.com/company/healthy-ventures/,29,9,
IDB Invest,https://www.crunchbase.com/organization/idb-invest,"Corporate Venture Capital, Private Equity Firm, Venture Debt",45,8,"Washington, District of Columbia, United States",Debt,IDB Invest provides financial solutions and advisory services that meet the needs of its clients in a variety of industries.,"Washington DC Metro Area, Southern US",1986-01-01,year,http://www.idbinvest.org,https://www.linkedin.com/company/idbinvest/,41,33,6
InnoSpring Seed Fund,https://www.crunchbase.com/organization/innospring,Incubator,45,14,"Palo Alto, California, United States",Seed,"InnoSpring Seed Fund is technology seed fund backed by growth-stage venture funds including KPCB, IDG Capital, Legend Capital, NLVC etc.","San Francisco Bay Area, Silicon Valley, West Coast",2012-04-11,day,http://www.innospringseedfund.com/,http://www.linkedin.com/company/innospring-inc-,40,1,
